project_id,site_id,num_days,data_type,date,start_date,end_date,year,deployment_id,is_blank,wi_taxon_id,class,order,family,genus,species,common_name,uncertainty,timestamp,number_of_objects,age,sex,animal_recognizable,individual_id,individual_animal_notes,behavior,highlighted,markings,cv_confidence,license,bounding_boxes,class_cemap,DH_data_source,CEMAP_common_name,Plotting_label,CEMAP_Group,CEMAP_combined,CEMAP_sci_name,cdfw_region,cannabis
2002875,SAHE1,77,SA,6/20/2023,6/13/2023,8/28/2023,2023,SA-SAHE1-2023,0,8b836e7b-a00d-4e83-9203-676dc9a54825,Mammalia,Rodentia,Geomyidae,Thomomys,NA,Thomomys Species,NA,2023-06-20T22:39:57Z,1,NA,NA,NA,NA,NA,NA,FALSE,NA,NA,CC-BY,NA,Mammal,SA_WI,Thomomys Species,Pocket gopher Species,Thomomys Species,Thomomys Species,NA,2,0
2002875,SAHE2,77,SA,8/8/2023,6/13/2023,8/28/2023,2023,SA-SAHE2-2023,0,adf63c9e-18c0-451a-a78f-4c29864bc1f5,Mammalia,Rodentia,NA,NA,NA,Mouse species,NA,2023-08-08T02:38:39Z,1,NA,NA,NA,NA,NA,NA,FALSE,NA,NA,CC-BY,NA,Mammal,SA_WI,Mouse Species,Mouse Species,Mouse Species,Mouse Species,NA,2,0
2002875,SAHE3,77,SA,6/20/2023,6/13/2023,8/28/2023,2023,SA-SAHE3-2023,0,8b836e7b-a00d-4e83-9203-676dc9a54825,Mammalia,Rodentia,Geomyidae,Thomomys,NA,Thomomys Species,NA,2023-06-20T22:39:58Z,1,NA,NA,NA,NA,NA,NA,FALSE,NA,NA,CC-BY,NA,Mammal,SA_WI,Thomomys Species,Pocket gopher Species,Thomomys Species,Thomomys Species,NA,2,0
2002875,SAHE1,77,SA,6/20/2023,6/13/2023,8/28/2023,2023,SA-SAHE1-2023,0,8b836e7b-a00d-4e83-9203-676dc9a54825,Mammalia,Rodentia,Geomyidae,Thomomys,NA,Thomomys Species,NA,2023-06-20T22:39:58Z,1,NA,NA,NA,NA,NA,NA,FALSE,NA,NA,CC-BY,NA,Mammal,SA_WI,Thomomys Species,Pocket gopher Species,Thomomys Species,Thomomys Species,NA,2,0
2002875,SAHE2,77,SA,8/8/2023,6/13/2023,8/28/2023,2023,SA-SAHE2-2023,0,5a06cb57-9553-46f9-ace2-fcfddbcdc753,Mammalia,Rodentia,Sciuridae,Neotamias,NA,Neotamias Species,NA,2023-08-08T07:37:30Z,1,NA,NA,NA,NA,NA,NA,FALSE,NA,NA,CC-BY,NA,Mammal,SA_WI,Neotamias Species,Chipmunk Species,Neotamias Species,Neotamias Species,NA,2,0
2002875,SAHE3,77,SA,8/8/2023,6/13/2023,8/28/2023,2023,SA-SAHE3-2023,0,5a06cb57-9553-46f9-ace2-fcfddbcdc753,Mammalia,Rodentia,Sciuridae,Neotamias,NA,Neotamias Species,NA,2023-08-08T07:37:31Z,1,NA,NA,NA,NA,NA,NA,FALSE,NA,NA,CC-BY,NA,Mammal,SA_WI,Neotamias Species,Chipmunk Species,Neotamias Species,Neotamias Species,NA,2,0
2002875,SAHE1,77,SA,8/8/2023,6/13/2023,8/28/2023,2023,SA-SAHE1-2023,0,5a06cb57-9553-46f9-ace2-fcfddbcdc753,Mammalia,Rodentia,Sciuridae,Neotamias,NA,Neotamias Species,NA,2023-08-08T07:37:31Z,1,NA,NA,NA,NA,NA,NA,FALSE,NA,NA,CC-BY,NA,Mammal,SA_WI,Neotamias Species,Chipmunk Species,Neotamias Species,Neotamias Species,NA,2,0
2002875,SAHE2,77,SA,8/8/2023,6/13/2023,8/28/2023,2023,SA-SAHE2-2023,0,5a06cb57-9553-46f9-ace2-fcfddbcdc753,Mammalia,Rodentia,Sciuridae,Neotamias,NA,Neotamias Species,NA,2023-08-08T07:37:36Z,1,NA,NA,NA,NA,NA,NA,FALSE,NA,NA,CC-BY,NA,Mammal,SA_WI,Neotamias Species,Chipmunk Species,Neotamias Species,Neotamias Species,NA,2,0
2002875,SAHE3,77,SA,8/8/2023,6/13/2023,8/28/2023,2023,SA-SAHE3-2023,0,5a06cb57-9553-46f9-ace2-fcfddbcdc753,Mammalia,Rodentia,Sciuridae,Neotamias,NA,Neotamias Species,NA,2023-08-08T07:37:36Z,1,NA,NA,NA,NA,NA,NA,FALSE,NA,NA,CC-BY,"{""{\""detectionBox\"":[0.734646142,0.368635476,0.982889,0.676460564]}""}",Mammal,SA_WI,Neotamias Species,Chipmunk Species,Neotamias Species,Neotamias Species,NA,2,0
2002875,SAHE1,77,SA,8/8/2023,6/13/2023,8/28/2023,2023,SA-SAHE1-2023,0,5a06cb57-9553-46f9-ace2-fcfddbcdc753,Mammalia,Rodentia,Sciuridae,Neotamias,NA,Neotamias Species,NA,2023-08-08T07:37:37Z,1,NA,NA,NA,NA,NA,NA,FALSE,NA,NA,CC-BY,NA,Mammal,SA_WI,Neotamias Species,Chipmunk Species,Neotamias Species,Neotamias Species,NA,2,0
2002875,SAHE2,77,SA,8/8/2023,6/13/2023,8/28/2023,2023,SA-SAHE2-2023,0,26a96746-25c9-406e-b3a1-1658f81ae0af,Mammalia,Eulipotyphla,Soricidae,NA,NA,Soricidae Family,NA,2023-08-08T22:12:50Z,1,NA,NA,NA,NA,NA,NA,FALSE,NA,NA,CC-BY,NA,Mammal,SA_WI,Soricidae Family,Shrew Family,Soricidae Family,Soricidae Family,NA,2,0
2002875,SAHE3,77,SA,8/8/2023,6/13/2023,8/28/2023,2023,SA-SAHE3-2023,0,26a96746-25c9-406e-b3a1-1658f81ae0af,Mammalia,Eulipotyphla,Soricidae,NA,NA,Soricidae Family,NA,2023-08-08T22:12:50Z,1,NA,NA,NA,NA,NA,NA,FALSE,NA,NA,CC-BY,NA,Mammal,SA_WI,Soricidae Family,Shrew Family,Soricidae Family,Soricidae Family,NA,2,0
2002875,SAHE1,77,SA,8/8/2023,6/13/2023,8/28/2023,2023,SA-SAHE1-2023,0,26a96746-25c9-406e-b3a1-1658f81ae0af,Mammalia,Eulipotyphla,Soricidae,NA,NA,Soricidae Family,NA,2023-08-08T22:12:49Z,1,NA,NA,NA,NA,NA,NA,FALSE,NA,NA,CC-BY,NA,Mammal,SA_WI,Soricidae Family,Shrew Family,Soricidae Family,Soricidae Family,NA,2,0
2002875,SAHE2,77,SA,6/21/2023,6/13/2023,8/28/2023,2023,SA-SAHE2-2023,0,5a06cb57-9553-46f9-ace2-fcfddbcdc753,Mammalia,Rodentia,Sciuridae,Neotamias,NA,Neotamias Species,NA,2023-06-21T10:35:53Z,1,NA,NA,NA,NA,NA,NA,FALSE,NA,NA,CC-BY,NA,Mammal,SA_WI,Neotamias Species,Chipmunk Species,Neotamias Species,Neotamias Species,NA,2,0
2002875,SAHE3,77,SA,8/8/2023,6/13/2023,8/28/2023,2023,SA-SAHE3-2023,0,26a96746-25c9-406e-b3a1-1658f81ae0af,Mammalia,Eulipotyphla,Soricidae,NA,NA,Soricidae Family,NA,2023-08-08T22:12:55Z,1,NA,NA,NA,NA,NA,NA,FALSE,NA,NA,CC-BY,NA,Mammal,SA_WI,Soricidae Family,Shrew Family,Soricidae Family,Soricidae Family,NA,2,0
2002875,SAHE1,77,SA,8/8/2023,6/13/2023,8/28/2023,2023,SA-SAHE1-2023,0,26a96746-25c9-406e-b3a1-1658f81ae0af,Mammalia,Eulipotyphla,Soricidae,NA,NA,Soricidae Family,NA,2023-08-08T22:12:55Z,1,NA,NA,NA,NA,NA,NA,FALSE,NA,NA,CC-BY,NA,Mammal,SA_WI,Soricidae Family,Shrew Family,Soricidae Family,Soricidae Family,NA,2,0
2002875,SAHE2,77,SA,8/8/2023,6/13/2023,8/28/2023,2023,SA-SAHE2-2023,0,26a96746-25c9-406e-b3a1-1658f81ae0af,Mammalia,Eulipotyphla,Soricidae,NA,NA,Soricidae Family,NA,2023-08-08T22:12:56Z,1,NA,NA,NA,NA,NA,NA,FALSE,NA,NA,CC-BY,NA,Mammal,SA_WI,Soricidae Family,Shrew Family,Soricidae Family,Soricidae Family,NA,2,0
2002875,SAHE3,77,SA,8/8/2023,6/13/2023,8/28/2023,2023,SA-SAHE3-2023,0,26a96746-25c9-406e-b3a1-1658f81ae0af,Mammalia,Eulipotyphla,Soricidae,NA,NA,Soricidae Family,NA,2023-08-08T22:12:58Z,1,NA,NA,NA,NA,NA,NA,FALSE,NA,NA,CC-BY,NA,Mammal,SA_WI,Soricidae Family,Shrew Family,Soricidae Family,Soricidae Family,NA,2,0
2002875,SAHE1,77,SA,8/8/2023,6/13/2023,8/28/2023,2023,SA-SAHE1-2023,0,26a96746-25c9-406e-b3a1-1658f81ae0af,Mammalia,Eulipotyphla,Soricidae,NA,NA,Soricidae Family,NA,2023-08-08T22:12:58Z,1,NA,NA,NA,NA,NA,NA,FALSE,NA,NA,CC-BY,NA,Mammal,SA_WI,Soricidae Family,Shrew Family,Soricidae Family,Soricidae Family,NA,2,0
2002875,SAHE2,77,SA,8/8/2023,6/13/2023,8/28/2023,2023,SA-SAHE2-2023,0,26a96746-25c9-406e-b3a1-1658f81ae0af,Mammalia,Eulipotyphla,Soricidae,NA,NA,Soricidae Family,NA,2023-08-08T22:12:59Z,1,NA,NA,NA,NA,NA,NA,FALSE,NA,NA,CC-BY,NA,Mammal,SA_WI,Soricidae Family,Shrew Family,Soricidae Family,Soricidae Family,NA,2,0
2002875,SAHE3,77,SA,8/8/2023,6/13/2023,8/28/2023,2023,SA-SAHE3-2023,0,26a96746-25c9-406e-b3a1-1658f81ae0af,Mammalia,Eulipotyphla,Soricidae,NA,NA,Soricidae Family,NA,2023-08-08T22:13:00Z,1,NA,NA,NA,NA,NA,NA,FALSE,NA,NA,CC-BY,NA,Mammal,SA_WI,Soricidae Family,Shrew Family,Soricidae Family,Soricidae Family,NA,2,0
2002875,SAHE1,77,SA,6/21/2023,6/13/2023,8/28/2023,2023,SA-SAHE1-2023,0,5a06cb57-9553-46f9-ace2-fcfddbcdc753,Mammalia,Rodentia,Sciuridae,Neotamias,NA,Neotamias Species,NA,2023-06-21T10:35:54Z,1,NA,NA,NA,NA,NA,NA,FALSE,NA,NA,CC-BY,NA,Mammal,SA_WI,Neotamias Species,Chipmunk Species,Neotamias Species,Neotamias Species,NA,2,0
2002875,SAHE2,77,SA,8/9/2023,6/13/2023,8/28/2023,2023,SA-SAHE2-2023,0,26a96746-25c9-406e-b3a1-1658f81ae0af,Mammalia,Eulipotyphla,Soricidae,NA,NA,Soricidae Family,NA,2023-08-09T00:43:43Z,1,NA,NA,NA,NA,NA,NA,FALSE,NA,NA,CC-BY,NA,Mammal,SA_WI,Soricidae Family,Shrew Family,Soricidae Family,Soricidae Family,NA,2,0
2002875,SAHE3,77,SA,8/9/2023,6/13/2023,8/28/2023,2023,SA-SAHE3-2023,0,26a96746-25c9-406e-b3a1-1658f81ae0af,Mammalia,Eulipotyphla,Soricidae,NA,NA,Soricidae Family,NA,2023-08-09T00:43:44Z,1,NA,NA,NA,NA,NA,NA,FALSE,NA,NA,CC-BY,NA,Mammal,SA_WI,Soricidae Family,Shrew Family,Soricidae Family,Soricidae Family,NA,2,0
2002875,SAHE1,77,SA,8/9/2023,6/13/2023,8/28/2023,2023,SA-SAHE1-2023,0,26a96746-25c9-406e-b3a1-1658f81ae0af,Mammalia,Eulipotyphla,Soricidae,NA,NA,Soricidae Family,NA,2023-08-09T00:43:45Z,1,NA,NA,NA,NA,NA,NA,FALSE,NA,NA,CC-BY,NA,Mammal,SA_WI,Soricidae Family,Shrew Family,Soricidae Family,Soricidae Family,NA,2,0
2002875,SAHE2,77,SA,8/9/2023,6/13/2023,8/28/2023,2023,SA-SAHE2-2023,0,26a96746-25c9-406e-b3a1-1658f81ae0af,Mammalia,Eulipotyphla,Soricidae,NA,NA,Soricidae Family,NA,2023-08-09T00:43:45Z,1,NA,NA,NA,NA,NA,NA,FALSE,NA,NA,CC-BY,NA,Mammal,SA_WI,Soricidae Family,Shrew Family,Soricidae Family,Soricidae Family,NA,2,0
2002875,SAHE3,77,SA,8/9/2023,6/13/2023,8/28/2023,2023,SA-SAHE3-2023,0,26a96746-25c9-406e-b3a1-1658f81ae0af,Mammalia,Eulipotyphla,Soricidae,NA,NA,Soricidae Family,NA,2023-08-09T00:43:46Z,1,NA,NA,NA,NA,NA,NA,FALSE,NA,NA,CC-BY,NA,Mammal,SA_WI,Soricidae Family,Shrew Family,Soricidae Family,Soricidae Family,NA,2,0
2002875,SAHE1,77,SA,8/9/2023,6/13/2023,8/28/2023,2023,SA-SAHE1-2023,0,26a96746-25c9-406e-b3a1-1658f81ae0af,Mammalia,Eulipotyphla,Soricidae,NA,NA,Soricidae Family,NA,2023-08-09T00:53:14Z,1,NA,NA,NA,NA,NA,NA,FALSE,NA,NA,CC-BY,NA,Mammal,SA_WI,Soricidae Family,Shrew Family,Soricidae Family,Soricidae Family,NA,2,0
2002875,SAHE2,77,SA,8/9/2023,6/13/2023,8/28/2023,2023,SA-SAHE2-2023,0,26a96746-25c9-406e-b3a1-1658f81ae0af,Mammalia,Eulipotyphla,Soricidae,NA,NA,Soricidae Family,NA,2023-08-09T00:53:14Z,1,NA,NA,NA,NA,NA,NA,FALSE,NA,NA,CC-BY,NA,Mammal,SA_WI,Soricidae Family,Shrew Family,Soricidae Family,Soricidae Family,NA,2,0
2002875,SAHE3,77,SA,8/9/2023,6/13/2023,8/28/2023,2023,SA-SAHE3-2023,0,26a96746-25c9-406e-b3a1-1658f81ae0af,Mammalia,Eulipotyphla,Soricidae,NA,NA,Soricidae Family,NA,2023-08-09T00:53:15Z,1,NA,NA,NA,NA,NA,NA,FALSE,NA,NA,CC-BY,NA,Mammal,SA_WI,Soricidae Family,Shrew Family,Soricidae Family,Soricidae Family,NA,2,0
2002875,SAHE1,77,SA,8/9/2023,6/13/2023,8/28/2023,2023,SA-SAHE1-2023,0,26a96746-25c9-406e-b3a1-1658f81ae0af,Mammalia,Eulipotyphla,Soricidae,NA,NA,Soricidae Family,NA,2023-08-09T00:53:18Z,1,NA,NA,NA,NA,NA,NA,FALSE,NA,NA,CC-BY,NA,Mammal,SA_WI,Soricidae Family,Shrew Family,Soricidae Family,Soricidae Family,NA,2,0
2002875,SAHE2,77,SA,6/21/2023,6/13/2023,8/28/2023,2023,SA-SAHE2-2023,0,5a06cb57-9553-46f9-ace2-fcfddbcdc753,Mammalia,Rodentia,Sciuridae,Neotamias,NA,Neotamias Species,NA,2023-06-21T10:35:54Z,1,NA,NA,NA,NA,NA,NA,FALSE,NA,NA,CC-BY,NA,Mammal,SA_WI,Neotamias Species,Chipmunk Species,Neotamias Species,Neotamias Species,NA,2,0
2002875,SAHE3,77,SA,8/9/2023,6/13/2023,8/28/2023,2023,SA-SAHE3-2023,0,26a96746-25c9-406e-b3a1-1658f81ae0af,Mammalia,Eulipotyphla,Soricidae,NA,NA,Soricidae Family,NA,2023-08-09T00:53:18Z,1,NA,NA,NA,NA,NA,NA,FALSE,NA,NA,CC-BY,NA,Mammal,SA_WI,Soricidae Family,Shrew Family,Soricidae Family,Soricidae Family,NA,2,0
2002875,SAHE1,77,SA,8/9/2023,6/13/2023,8/28/2023,2023,SA-SAHE1-2023,0,26a96746-25c9-406e-b3a1-1658f81ae0af,Mammalia,Eulipotyphla,Soricidae,NA,NA,Soricidae Family,NA,2023-08-09T00:53:20Z,1,NA,NA,NA,NA,NA,NA,FALSE,NA,NA,CC-BY,NA,Mammal,SA_WI,Soricidae Family,Shrew Family,Soricidae Family,Soricidae Family,NA,2,0
2002875,SAHE2,77,SA,8/9/2023,6/13/2023,8/28/2023,2023,SA-SAHE2-2023,0,26a96746-25c9-406e-b3a1-1658f81ae0af,Mammalia,Eulipotyphla,Soricidae,NA,NA,Soricidae Family,NA,2023-08-09T00:53:21Z,1,NA,NA,NA,NA,NA,NA,FALSE,NA,NA,CC-BY,NA,Mammal,SA_WI,Soricidae Family,Shrew Family,Soricidae Family,Soricidae Family,NA,2,0
2002875,SAHE3,77,SA,8/9/2023,6/13/2023,8/28/2023,2023,SA-SAHE3-2023,0,26a96746-25c9-406e-b3a1-1658f81ae0af,Mammalia,Eulipotyphla,Soricidae,NA,NA,Soricidae Family,NA,2023-08-09T00:53:22Z,1,NA,NA,NA,NA,NA,NA,FALSE,NA,NA,CC-BY,"{""{\""detectionBox\"":[0.81366384,0.51114732,0.98529315,0.805994809]}""}",Mammal,SA_WI,Soricidae Family,Shrew Family,Soricidae Family,Soricidae Family,NA,2,0
2002875,SAHE1,77,SA,8/9/2023,6/13/2023,8/28/2023,2023,SA-SAHE1-2023,0,26a96746-25c9-406e-b3a1-1658f81ae0af,Mammalia,Eulipotyphla,Soricidae,NA,NA,Soricidae Family,NA,2023-08-09T00:53:25Z,1,NA,NA,NA,NA,NA,NA,FALSE,NA,NA,CC-BY,NA,Mammal,SA_WI,Soricidae Family,Shrew Family,Soricidae Family,Soricidae Family,NA,2,0
2002875,SAHE2,77,SA,8/9/2023,6/13/2023,8/28/2023,2023,SA-SAHE2-2023,0,26a96746-25c9-406e-b3a1-1658f81ae0af,Mammalia,Eulipotyphla,Soricidae,NA,NA,Soricidae Family,NA,2023-08-09T00:53:25Z,1,NA,NA,NA,NA,NA,NA,FALSE,NA,NA,CC-BY,NA,Mammal,SA_WI,Soricidae Family,Shrew Family,Soricidae Family,Soricidae Family,NA,2,0
2002875,SAHE3,77,SA,8/9/2023,6/13/2023,8/28/2023,2023,SA-SAHE3-2023,0,26a96746-25c9-406e-b3a1-1658f81ae0af,Mammalia,Eulipotyphla,Soricidae,NA,NA,Soricidae Family,NA,2023-08-09T00:58:56Z,1,NA,NA,NA,NA,NA,NA,FALSE,NA,NA,CC-BY,NA,Mammal,SA_WI,Soricidae Family,Shrew Family,Soricidae Family,Soricidae Family,NA,2,0
2002875,SAHE1,77,SA,8/9/2023,6/13/2023,8/28/2023,2023,SA-SAHE1-2023,0,26a96746-25c9-406e-b3a1-1658f81ae0af,Mammalia,Eulipotyphla,Soricidae,NA,NA,Soricidae Family,NA,2023-08-09T00:58:56Z,1,NA,NA,NA,NA,NA,NA,FALSE,NA,NA,CC-BY,NA,Mammal,SA_WI,Soricidae Family,Shrew Family,Soricidae Family,Soricidae Family,NA,2,0
2002875,SAHE2,77,SA,8/9/2023,6/13/2023,8/28/2023,2023,SA-SAHE2-2023,0,26a96746-25c9-406e-b3a1-1658f81ae0af,Mammalia,Eulipotyphla,Soricidae,NA,NA,Soricidae Family,NA,2023-08-09T00:58:57Z,1,NA,NA,NA,NA,NA,NA,FALSE,NA,NA,CC-BY,"{""{\""detectionBox\"":[0.205974266,0.603512883,0.628741,0.820046782]}""}",Mammal,SA_WI,Soricidae Family,Shrew Family,Soricidae Family,Soricidae Family,NA,2,0
2002875,SAHE3,77,SA,8/9/2023,6/13/2023,8/28/2023,2023,SA-SAHE3-2023,0,26a96746-25c9-406e-b3a1-1658f81ae0af,Mammalia,Eulipotyphla,Soricidae,NA,NA,Soricidae Family,NA,2023-08-09T03:39:52Z,1,NA,NA,NA,NA,NA,NA,FALSE,NA,NA,CC-BY,NA,Mammal,SA_WI,Soricidae Family,Shrew Family,Soricidae Family,Soricidae Family,NA,2,0
2002875,SAHE1,77,SA,8/9/2023,6/13/2023,8/28/2023,2023,SA-SAHE1-2023,0,26a96746-25c9-406e-b3a1-1658f81ae0af,Mammalia,Eulipotyphla,Soricidae,NA,NA,Soricidae Family,NA,2023-08-09T03:39:53Z,1,NA,NA,NA,NA,NA,NA,FALSE,NA,NA,CC-BY,NA,Mammal,SA_WI,Soricidae Family,Shrew Family,Soricidae Family,Soricidae Family,NA,2,0
2002875,SAHE2,77,SA,8/9/2023,6/13/2023,8/28/2023,2023,SA-SAHE2-2023,0,26a96746-25c9-406e-b3a1-1658f81ae0af,Mammalia,Eulipotyphla,Soricidae,NA,NA,Soricidae Family,NA,2023-08-09T03:39:53Z,1,NA,NA,NA,NA,NA,NA,FALSE,NA,NA,CC-BY,NA,Mammal,SA_WI,Soricidae Family,Shrew Family,Soricidae Family,Soricidae Family,NA,2,0
2002875,SAHE3,77,SA,8/9/2023,6/13/2023,8/28/2023,2023,SA-SAHE3-2023,0,26a96746-25c9-406e-b3a1-1658f81ae0af,Mammalia,Eulipotyphla,Soricidae,NA,NA,Soricidae Family,NA,2023-08-09T03:39:54Z,1,NA,NA,NA,NA,NA,NA,FALSE,NA,NA,CC-BY,NA,Mammal,SA_WI,Soricidae Family,Shrew Family,Soricidae Family,Soricidae Family,NA,2,0
2002875,SAHE1,77,SA,8/9/2023,6/13/2023,8/28/2023,2023,SA-SAHE1-2023,0,26a96746-25c9-406e-b3a1-1658f81ae0af,Mammalia,Eulipotyphla,Soricidae,NA,NA,Soricidae Family,NA,2023-08-09T03:39:55Z,1,NA,NA,NA,NA,NA,NA,FALSE,NA,NA,CC-BY,NA,Mammal,SA_WI,Soricidae Family,Shrew Family,Soricidae Family,Soricidae Family,NA,2,0
2002875,SAHE2,77,SA,6/22/2023,6/13/2023,8/28/2023,2023,SA-SAHE2-2023,0,5a06cb57-9553-46f9-ace2-fcfddbcdc753,Mammalia,Rodentia,Sciuridae,Neotamias,NA,Neotamias Species,NA,2023-06-22T12:06:44Z,1,NA,NA,NA,NA,NA,NA,FALSE,NA,NA,CC-BY,NA,Mammal,SA_WI,Neotamias Species,Chipmunk Species,Neotamias Species,Neotamias Species,NA,2,0
2002875,SAHE3,77,SA,6/22/2023,6/13/2023,8/28/2023,2023,SA-SAHE3-2023,0,5a06cb57-9553-46f9-ace2-fcfddbcdc753,Mammalia,Rodentia,Sciuridae,Neotamias,NA,Neotamias Species,NA,2023-06-22T12:06:44Z,1,NA,NA,NA,NA,NA,NA,FALSE,NA,NA,CC-BY,"{""{\""detectionBox\"":[0.436013222,0.701737821,0.559584498,0.76936096]}""}",Mammal,SA_WI,Neotamias Species,Chipmunk Species,Neotamias Species,Neotamias Species,NA,2,0
2002875,SAHE1,77,SA,8/9/2023,6/13/2023,8/28/2023,2023,SA-SAHE1-2023,0,b8842ac0-ed8d-4790-a491-524eeba86594,Mammalia,Rodentia,Sciuridae,Neotamias,quadrimaculatus,Long-eared Chipmunk,NA,2023-08-09T09:26:53Z,1,NA,NA,NA,NA,NA,NA,FALSE,NA,NA,CC-BY,NA,Mammal,SA_WI,Long-eared Chipmunk,Chipmunk Species,Neotamias Species,Neotamias Species,Neotamias quadrimaculatus,2,0
2002875,SAHE2,77,SA,8/9/2023,6/13/2023,8/28/2023,2023,SA-SAHE2-2023,0,b8842ac0-ed8d-4790-a491-524eeba86594,Mammalia,Rodentia,Sciuridae,Neotamias,quadrimaculatus,Long-eared Chipmunk,NA,2023-08-09T09:26:54Z,1,NA,NA,NA,NA,NA,NA,FALSE,NA,NA,CC-BY,NA,Mammal,SA_WI,Long-eared Chipmunk,Chipmunk Species,Neotamias Species,Neotamias Species,Neotamias quadrimaculatus,2,0
2002875,SAHE3,77,SA,8/9/2023,6/13/2023,8/28/2023,2023,SA-SAHE3-2023,0,b8842ac0-ed8d-4790-a491-524eeba86594,Mammalia,Rodentia,Sciuridae,Neotamias,quadrimaculatus,Long-eared Chipmunk,NA,2023-08-09T09:26:54Z,1,NA,NA,NA,NA,NA,NA,FALSE,NA,NA,CC-BY,NA,Mammal,SA_WI,Long-eared Chipmunk,Chipmunk Species,Neotamias Species,Neotamias Species,Neotamias quadrimaculatus,2,0
2002875,SAHE1,77,SA,8/9/2023,6/13/2023,8/28/2023,2023,SA-SAHE1-2023,0,5a06cb57-9553-46f9-ace2-fcfddbcdc753,Mammalia,Rodentia,Sciuridae,Neotamias,NA,Neotamias Species,NA,2023-08-09T10:36:16Z,1,NA,NA,NA,NA,NA,NA,FALSE,NA,NA,CC-BY,NA,Mammal,SA_WI,Neotamias Species,Chipmunk Species,Neotamias Species,Neotamias Species,NA,2,0
2002875,SAHE2,77,SA,6/22/2023,6/13/2023,8/28/2023,2023,SA-SAHE2-2023,0,5a06cb57-9553-46f9-ace2-fcfddbcdc753,Mammalia,Rodentia,Sciuridae,Neotamias,NA,Neotamias Species,NA,2023-06-22T13:08:52Z,1,NA,NA,NA,NA,NA,NA,FALSE,NA,NA,CC-BY,NA,Mammal,SA_WI,Neotamias Species,Chipmunk Species,Neotamias Species,Neotamias Species,NA,2,0
2002875,SAHE3,77,SA,8/9/2023,6/13/2023,8/28/2023,2023,SA-SAHE3-2023,0,5a06cb57-9553-46f9-ace2-fcfddbcdc753,Mammalia,Rodentia,Sciuridae,Neotamias,NA,Neotamias Species,NA,2023-08-09T13:12:17Z,1,NA,NA,NA,NA,NA,NA,FALSE,NA,NA,CC-BY,NA,Mammal,SA_WI,Neotamias Species,Chipmunk Species,Neotamias Species,Neotamias Species,NA,2,0
2002875,SAHE1,77,SA,8/9/2023,6/13/2023,8/28/2023,2023,SA-SAHE1-2023,0,5a06cb57-9553-46f9-ace2-fcfddbcdc753,Mammalia,Rodentia,Sciuridae,Neotamias,NA,Neotamias Species,NA,2023-08-09T13:12:17Z,1,NA,NA,NA,NA,NA,NA,FALSE,NA,NA,CC-BY,NA,Mammal,SA_WI,Neotamias Species,Chipmunk Species,Neotamias Species,Neotamias Species,NA,2,0
2002875,SAHE2,77,SA,8/9/2023,6/13/2023,8/28/2023,2023,SA-SAHE2-2023,0,5a06cb57-9553-46f9-ace2-fcfddbcdc753,Mammalia,Rodentia,Sciuridae,Neotamias,NA,Neotamias Species,NA,2023-08-09T13:12:18Z,1,NA,NA,NA,NA,NA,NA,FALSE,NA,NA,CC-BY,NA,Mammal,SA_WI,Neotamias Species,Chipmunk Species,Neotamias Species,Neotamias Species,NA,2,0
2002875,SAHE3,77,SA,8/9/2023,6/13/2023,8/28/2023,2023,SA-SAHE3-2023,0,5a06cb57-9553-46f9-ace2-fcfddbcdc753,Mammalia,Rodentia,Sciuridae,Neotamias,NA,Neotamias Species,NA,2023-08-09T13:12:44Z,1,NA,NA,NA,NA,NA,NA,FALSE,NA,NA,CC-BY,NA,Mammal,SA_WI,Neotamias Species,Chipmunk Species,Neotamias Species,Neotamias Species,NA,2,0
2002875,SAHE1,77,SA,8/9/2023,6/13/2023,8/28/2023,2023,SA-SAHE1-2023,0,5a06cb57-9553-46f9-ace2-fcfddbcdc753,Mammalia,Rodentia,Sciuridae,Neotamias,NA,Neotamias Species,NA,2023-08-09T13:12:44Z,1,NA,NA,NA,NA,NA,NA,FALSE,NA,NA,CC-BY,NA,Mammal,SA_WI,Neotamias Species,Chipmunk Species,Neotamias Species,Neotamias Species,NA,2,0
2002875,SAHE2,77,SA,8/9/2023,6/13/2023,8/28/2023,2023,SA-SAHE2-2023,0,5a06cb57-9553-46f9-ace2-fcfddbcdc753,Mammalia,Rodentia,Sciuridae,Neotamias,NA,Neotamias Species,NA,2023-08-09T13:12:45Z,1,NA,NA,NA,NA,NA,NA,FALSE,NA,NA,CC-BY,NA,Mammal,SA_WI,Neotamias Species,Chipmunk Species,Neotamias Species,Neotamias Species,NA,2,0
2002875,SAHE3,77,SA,8/9/2023,6/13/2023,8/28/2023,2023,SA-SAHE3-2023,0,5a06cb57-9553-46f9-ace2-fcfddbcdc753,Mammalia,Rodentia,Sciuridae,Neotamias,NA,Neotamias Species,NA,2023-08-09T13:12:46Z,1,NA,NA,NA,NA,NA,NA,FALSE,NA,NA,CC-BY,NA,Mammal,SA_WI,Neotamias Species,Chipmunk Species,Neotamias Species,Neotamias Species,NA,2,0
2002875,SAHE1,77,SA,8/9/2023,6/13/2023,8/28/2023,2023,SA-SAHE1-2023,0,5a06cb57-9553-46f9-ace2-fcfddbcdc753,Mammalia,Rodentia,Sciuridae,Neotamias,NA,Neotamias Species,NA,2023-08-09T13:12:46Z,1,NA,NA,NA,NA,NA,NA,FALSE,NA,NA,CC-BY,NA,Mammal,SA_WI,Neotamias Species,Chipmunk Species,Neotamias Species,Neotamias Species,NA,2,0
2002875,SAHE2,77,SA,8/9/2023,6/13/2023,8/28/2023,2023,SA-SAHE2-2023,0,5a06cb57-9553-46f9-ace2-fcfddbcdc753,Mammalia,Rodentia,Sciuridae,Neotamias,NA,Neotamias Species,NA,2023-08-09T13:12:47Z,1,NA,NA,NA,NA,NA,NA,FALSE,NA,NA,CC-BY,NA,Mammal,SA_WI,Neotamias Species,Chipmunk Species,Neotamias Species,Neotamias Species,NA,2,0
2002875,SAHE3,77,SA,8/9/2023,6/13/2023,8/28/2023,2023,SA-SAHE3-2023,0,b8842ac0-ed8d-4790-a491-524eeba86594,Mammalia,Rodentia,Sciuridae,Neotamias,quadrimaculatus,Long-eared Chipmunk,NA,2023-08-09T13:42:38Z,1,NA,NA,NA,NA,NA,NA,FALSE,NA,NA,CC-BY,NA,Mammal,SA_WI,Long-eared Chipmunk,Chipmunk Species,Neotamias Species,Neotamias Species,Neotamias quadrimaculatus,2,0
2002875,SAHE1,77,SA,8/9/2023,6/13/2023,8/28/2023,2023,SA-SAHE1-2023,0,b8842ac0-ed8d-4790-a491-524eeba86594,Mammalia,Rodentia,Sciuridae,Neotamias,quadrimaculatus,Long-eared Chipmunk,NA,2023-08-09T13:42:39Z,1,NA,NA,NA,NA,NA,NA,FALSE,NA,NA,CC-BY,"{""{\""detectionBox\"":[0.825442612,0.330861449,0.979586363,0.557228923]}""}",Mammal,SA_WI,Long-eared Chipmunk,Chipmunk Species,Neotamias Species,Neotamias Species,Neotamias quadrimaculatus,2,0
2002875,SAHE2,77,SA,8/9/2023,6/13/2023,8/28/2023,2023,SA-SAHE2-2023,0,d01f67fd-836b-4b25-89fc-2239e59f56b0,Mammalia,Rodentia,Sciuridae,Otospermophilus,beecheyi,California Ground Squirrel,NA,2023-08-09T14:04:14Z,1,NA,NA,NA,NA,NA,NA,FALSE,NA,NA,CC-BY,NA,Mammal,SA_WI,California Ground Squirrel,California ground squirrel,California Ground Squirrel,California Ground Squirrel,Otospermophilus beecheyi,2,0
2002875,SAHE3,77,SA,8/9/2023,6/13/2023,8/28/2023,2023,SA-SAHE3-2023,0,d01f67fd-836b-4b25-89fc-2239e59f56b0,Mammalia,Rodentia,Sciuridae,Otospermophilus,beecheyi,California Ground Squirrel,NA,2023-08-09T14:04:15Z,1,NA,NA,NA,NA,NA,NA,FALSE,NA,NA,CC-BY,NA,Mammal,SA_WI,California Ground Squirrel,California ground squirrel,California Ground Squirrel,California Ground Squirrel,Otospermophilus beecheyi,2,0
2002875,SAHE1,77,SA,8/9/2023,6/13/2023,8/28/2023,2023,SA-SAHE1-2023,0,d01f67fd-836b-4b25-89fc-2239e59f56b0,Mammalia,Rodentia,Sciuridae,Otospermophilus,beecheyi,California Ground Squirrel,NA,2023-08-09T14:04:15Z,1,NA,NA,NA,NA,NA,NA,FALSE,NA,NA,CC-BY,NA,Mammal,SA_WI,California Ground Squirrel,California ground squirrel,California Ground Squirrel,California Ground Squirrel,Otospermophilus beecheyi,2,0
2002875,SAHE2,77,SA,8/9/2023,6/13/2023,8/28/2023,2023,SA-SAHE2-2023,0,d01f67fd-836b-4b25-89fc-2239e59f56b0,Mammalia,Rodentia,Sciuridae,Otospermophilus,beecheyi,California Ground Squirrel,NA,2023-08-09T14:04:17Z,1,NA,NA,NA,NA,NA,NA,FALSE,NA,NA,CC-BY,NA,Mammal,SA_WI,California Ground Squirrel,California ground squirrel,California Ground Squirrel,California Ground Squirrel,Otospermophilus beecheyi,2,0
2002875,SAHE3,77,SA,8/9/2023,6/13/2023,8/28/2023,2023,SA-SAHE3-2023,0,d01f67fd-836b-4b25-89fc-2239e59f56b0,Mammalia,Rodentia,Sciuridae,Otospermophilus,beecheyi,California Ground Squirrel,NA,2023-08-09T14:04:18Z,1,NA,NA,NA,NA,NA,NA,FALSE,NA,NA,CC-BY,NA,Mammal,SA_WI,California Ground Squirrel,California ground squirrel,California Ground Squirrel,California Ground Squirrel,Otospermophilus beecheyi,2,0
2002875,SAHE1,77,SA,8/9/2023,6/13/2023,8/28/2023,2023,SA-SAHE1-2023,0,d01f67fd-836b-4b25-89fc-2239e59f56b0,Mammalia,Rodentia,Sciuridae,Otospermophilus,beecheyi,California Ground Squirrel,NA,2023-08-09T14:07:22Z,1,NA,NA,NA,NA,NA,NA,FALSE,NA,NA,CC-BY,NA,Mammal,SA_WI,California Ground Squirrel,California ground squirrel,California Ground Squirrel,California Ground Squirrel,Otospermophilus beecheyi,2,0
2002875,SAHE2,77,SA,8/9/2023,6/13/2023,8/28/2023,2023,SA-SAHE2-2023,0,d01f67fd-836b-4b25-89fc-2239e59f56b0,Mammalia,Rodentia,Sciuridae,Otospermophilus,beecheyi,California Ground Squirrel,NA,2023-08-09T14:07:23Z,1,NA,NA,NA,NA,NA,NA,FALSE,NA,NA,CC-BY,"{""{\""detectionBox\"":[0.02983246,0.0018646419,1,0.983344555]}""}",Mammal,SA_WI,California Ground Squirrel,California ground squirrel,California Ground Squirrel,California Ground Squirrel,Otospermophilus beecheyi,2,0
2002875,SAHE3,77,SA,8/9/2023,6/13/2023,8/28/2023,2023,SA-SAHE3-2023,0,adf63c9e-18c0-451a-a78f-4c29864bc1f5,Mammalia,Rodentia,NA,NA,NA,Mouse species,NA,2023-08-09T22:00:35Z,1,NA,NA,NA,NA,NA,NA,FALSE,NA,NA,CC-BY,NA,Mammal,SA_WI,Mouse Species,Mouse Species,Mouse Species,Mouse Species,NA,2,0
2002875,SAHE1,77,SA,8/9/2023,6/13/2023,8/28/2023,2023,SA-SAHE1-2023,0,adf63c9e-18c0-451a-a78f-4c29864bc1f5,Mammalia,Rodentia,NA,NA,NA,Mouse species,NA,2023-08-09T22:00:35Z,1,NA,NA,NA,NA,NA,NA,FALSE,NA,NA,CC-BY,"{""{\""detectionBox\"":[0.541100621,0.0521258712,0.96740371,0.459905446]}""}",Mammal,SA_WI,Mouse Species,Mouse Species,Mouse Species,Mouse Species,NA,2,0
2002875,SAHE2,77,SA,8/9/2023,6/13/2023,8/28/2023,2023,SA-SAHE2-2023,0,adf63c9e-18c0-451a-a78f-4c29864bc1f5,Mammalia,Rodentia,NA,NA,NA,Mouse species,NA,2023-08-09T22:00:36Z,1,NA,NA,NA,NA,NA,NA,FALSE,NA,NA,CC-BY,"{""{\""detectionBox\"":[0.563987136,0.00296829641,0.980092049,0.318831444]}""}",Mammal,SA_WI,Mouse Species,Mouse Species,Mouse Species,Mouse Species,NA,2,0
2002875,SAHE3,77,SA,8/9/2023,6/13/2023,8/28/2023,2023,SA-SAHE3-2023,0,adf63c9e-18c0-451a-a78f-4c29864bc1f5,Mammalia,Rodentia,NA,NA,NA,Mouse species,NA,2023-08-09T22:00:37Z,1,NA,NA,NA,NA,NA,NA,FALSE,NA,NA,CC-BY,"{""{\""detectionBox\"":[0.142981172,0,0.721268594,0.206326604]}""}",Mammal,SA_WI,Mouse Species,Mouse Species,Mouse Species,Mouse Species,NA,2,0
2002875,SAHE1,77,SA,8/9/2023,6/13/2023,8/28/2023,2023,SA-SAHE1-2023,0,adf63c9e-18c0-451a-a78f-4c29864bc1f5,Mammalia,Rodentia,NA,NA,NA,Mouse species,NA,2023-08-09T22:00:38Z,1,NA,NA,NA,NA,NA,NA,FALSE,NA,NA,CC-BY,NA,Mammal,SA_WI,Mouse Species,Mouse Species,Mouse Species,Mouse Species,NA,2,0
2002875,SAHE2,77,SA,8/9/2023,6/13/2023,8/28/2023,2023,SA-SAHE2-2023,0,adf63c9e-18c0-451a-a78f-4c29864bc1f5,Mammalia,Rodentia,NA,NA,NA,Mouse species,NA,2023-08-09T22:00:38Z,1,NA,NA,NA,NA,NA,NA,FALSE,NA,NA,CC-BY,NA,Mammal,SA_WI,Mouse Species,Mouse Species,Mouse Species,Mouse Species,NA,2,0
2002875,SAHE3,77,SA,8/9/2023,6/13/2023,8/28/2023,2023,SA-SAHE3-2023,0,26a96746-25c9-406e-b3a1-1658f81ae0af,Mammalia,Eulipotyphla,Soricidae,NA,NA,Soricidae Family,NA,2023-08-09T23:24:00Z,1,NA,NA,NA,NA,NA,NA,FALSE,NA,NA,CC-BY,NA,Mammal,SA_WI,Soricidae Family,Shrew Family,Soricidae Family,Soricidae Family,NA,2,0
2002875,SAHE1,77,SA,8/9/2023,6/13/2023,8/28/2023,2023,SA-SAHE1-2023,0,26a96746-25c9-406e-b3a1-1658f81ae0af,Mammalia,Eulipotyphla,Soricidae,NA,NA,Soricidae Family,NA,2023-08-09T23:24:01Z,1,NA,NA,NA,NA,NA,NA,FALSE,NA,NA,CC-BY,NA,Mammal,SA_WI,Soricidae Family,Shrew Family,Soricidae Family,Soricidae Family,NA,2,0
2002875,SAHE2,77,SA,8/9/2023,6/13/2023,8/28/2023,2023,SA-SAHE2-2023,0,26a96746-25c9-406e-b3a1-1658f81ae0af,Mammalia,Eulipotyphla,Soricidae,NA,NA,Soricidae Family,NA,2023-08-09T23:24:01Z,1,NA,NA,NA,NA,NA,NA,FALSE,NA,NA,CC-BY,NA,Mammal,SA_WI,Soricidae Family,Shrew Family,Soricidae Family,Soricidae Family,NA,2,0
2002875,SAHE3,77,SA,8/9/2023,6/13/2023,8/28/2023,2023,SA-SAHE3-2023,0,26a96746-25c9-406e-b3a1-1658f81ae0af,Mammalia,Eulipotyphla,Soricidae,NA,NA,Soricidae Family,NA,2023-08-09T23:24:03Z,1,NA,NA,NA,NA,NA,NA,FALSE,NA,NA,CC-BY,NA,Mammal,SA_WI,Soricidae Family,Shrew Family,Soricidae Family,Soricidae Family,NA,2,0
2002875,SAHE1,77,SA,8/9/2023,6/13/2023,8/28/2023,2023,SA-SAHE1-2023,0,26a96746-25c9-406e-b3a1-1658f81ae0af,Mammalia,Eulipotyphla,Soricidae,NA,NA,Soricidae Family,NA,2023-08-09T23:24:03Z,1,NA,NA,NA,NA,NA,NA,FALSE,NA,NA,CC-BY,NA,Mammal,SA_WI,Soricidae Family,Shrew Family,Soricidae Family,Soricidae Family,NA,2,0
2002875,SAHE2,77,SA,8/9/2023,6/13/2023,8/28/2023,2023,SA-SAHE2-2023,0,26a96746-25c9-406e-b3a1-1658f81ae0af,Mammalia,Eulipotyphla,Soricidae,NA,NA,Soricidae Family,NA,2023-08-09T23:24:04Z,1,NA,NA,NA,NA,NA,NA,FALSE,NA,NA,CC-BY,NA,Mammal,SA_WI,Soricidae Family,Shrew Family,Soricidae Family,Soricidae Family,NA,2,0
2002875,SAHE3,77,SA,8/9/2023,6/13/2023,8/28/2023,2023,SA-SAHE3-2023,0,26a96746-25c9-406e-b3a1-1658f81ae0af,Mammalia,Eulipotyphla,Soricidae,NA,NA,Soricidae Family,NA,2023-08-09T23:24:06Z,1,NA,NA,NA,NA,NA,NA,FALSE,NA,NA,CC-BY,NA,Mammal,SA_WI,Soricidae Family,Shrew Family,Soricidae Family,Soricidae Family,NA,2,0
2002875,SAHE1,77,SA,8/9/2023,6/13/2023,8/28/2023,2023,SA-SAHE1-2023,0,26a96746-25c9-406e-b3a1-1658f81ae0af,Mammalia,Eulipotyphla,Soricidae,NA,NA,Soricidae Family,NA,2023-08-09T23:24:06Z,1,NA,NA,NA,NA,NA,NA,FALSE,NA,NA,CC-BY,NA,Mammal,SA_WI,Soricidae Family,Shrew Family,Soricidae Family,Soricidae Family,NA,2,0
2002875,SAHE2,77,SA,8/9/2023,6/13/2023,8/28/2023,2023,SA-SAHE2-2023,0,26a96746-25c9-406e-b3a1-1658f81ae0af,Mammalia,Eulipotyphla,Soricidae,NA,NA,Soricidae Family,NA,2023-08-09T23:24:07Z,1,NA,NA,NA,NA,NA,NA,FALSE,NA,NA,CC-BY,NA,Mammal,SA_WI,Soricidae Family,Shrew Family,Soricidae Family,Soricidae Family,NA,2,0
2002875,SAHE3,77,SA,8/9/2023,6/13/2023,8/28/2023,2023,SA-SAHE3-2023,0,26a96746-25c9-406e-b3a1-1658f81ae0af,Mammalia,Eulipotyphla,Soricidae,NA,NA,Soricidae Family,NA,2023-08-09T23:24:09Z,1,NA,NA,NA,NA,NA,NA,FALSE,NA,NA,CC-BY,NA,Mammal,SA_WI,Soricidae Family,Shrew Family,Soricidae Family,Soricidae Family,NA,2,0
2002875,SAHE1,77,SA,8/9/2023,6/13/2023,8/28/2023,2023,SA-SAHE1-2023,0,26a96746-25c9-406e-b3a1-1658f81ae0af,Mammalia,Eulipotyphla,Soricidae,NA,NA,Soricidae Family,NA,2023-08-09T23:24:10Z,1,NA,NA,NA,NA,NA,NA,FALSE,NA,NA,CC-BY,NA,Mammal,SA_WI,Soricidae Family,Shrew Family,Soricidae Family,Soricidae Family,NA,2,0
2002875,SAHE2,77,SA,6/23/2023,6/13/2023,8/28/2023,2023,SA-SAHE2-2023,0,26a96746-25c9-406e-b3a1-1658f81ae0af,Mammalia,Eulipotyphla,Soricidae,NA,NA,Soricidae Family,NA,2023-06-23T05:45:35Z,1,NA,NA,NA,NA,NA,NA,FALSE,NA,NA,CC-BY,NA,Mammal,SA_WI,Soricidae Family,Shrew Family,Soricidae Family,Soricidae Family,NA,2,0
2002875,SAHE3,77,SA,8/10/2023,6/13/2023,8/28/2023,2023,SA-SAHE3-2023,0,26a96746-25c9-406e-b3a1-1658f81ae0af,Mammalia,Eulipotyphla,Soricidae,NA,NA,Soricidae Family,NA,2023-08-10T04:41:03Z,1,NA,NA,NA,NA,NA,NA,FALSE,NA,NA,CC-BY,NA,Mammal,SA_WI,Soricidae Family,Shrew Family,Soricidae Family,Soricidae Family,NA,2,0
2002875,SAHE1,77,SA,8/10/2023,6/13/2023,8/28/2023,2023,SA-SAHE1-2023,0,5a06cb57-9553-46f9-ace2-fcfddbcdc753,Mammalia,Rodentia,Sciuridae,Neotamias,NA,Neotamias Species,NA,2023-08-10T06:31:18Z,1,NA,NA,NA,NA,NA,NA,FALSE,NA,NA,CC-BY,NA,Mammal,SA_WI,Neotamias Species,Chipmunk Species,Neotamias Species,Neotamias Species,NA,2,0
2002875,SAHE2,77,SA,8/10/2023,6/13/2023,8/28/2023,2023,SA-SAHE2-2023,0,5a06cb57-9553-46f9-ace2-fcfddbcdc753,Mammalia,Rodentia,Sciuridae,Neotamias,NA,Neotamias Species,NA,2023-08-10T06:35:21Z,1,NA,NA,NA,NA,NA,NA,FALSE,NA,NA,CC-BY,NA,Mammal,SA_WI,Neotamias Species,Chipmunk Species,Neotamias Species,Neotamias Species,NA,2,0
2002875,SAHE3,77,SA,6/23/2023,6/13/2023,8/28/2023,2023,SA-SAHE3-2023,0,26a96746-25c9-406e-b3a1-1658f81ae0af,Mammalia,Eulipotyphla,Soricidae,NA,NA,Soricidae Family,NA,2023-06-23T05:45:36Z,1,NA,NA,NA,NA,NA,NA,FALSE,NA,NA,CC-BY,NA,Mammal,SA_WI,Soricidae Family,Shrew Family,Soricidae Family,Soricidae Family,NA,2,0
2002875,SAHE1,77,SA,6/23/2023,6/13/2023,8/28/2023,2023,SA-SAHE1-2023,0,26a96746-25c9-406e-b3a1-1658f81ae0af,Mammalia,Eulipotyphla,Soricidae,NA,NA,Soricidae Family,NA,2023-06-23T05:45:36Z,1,NA,NA,NA,NA,NA,NA,FALSE,NA,NA,CC-BY,NA,Mammal,SA_WI,Soricidae Family,Shrew Family,Soricidae Family,Soricidae Family,NA,2,0
2002875,SAHE2,77,SA,8/10/2023,6/13/2023,8/28/2023,2023,SA-SAHE2-2023,0,5a06cb57-9553-46f9-ace2-fcfddbcdc753,Mammalia,Rodentia,Sciuridae,Neotamias,NA,Neotamias Species,NA,2023-08-10T08:23:20Z,1,NA,NA,NA,NA,NA,NA,FALSE,NA,NA,CC-BY,NA,Mammal,SA_WI,Neotamias Species,Chipmunk Species,Neotamias Species,Neotamias Species,NA,2,0
2002875,SAHE3,77,SA,8/10/2023,6/13/2023,8/28/2023,2023,SA-SAHE3-2023,0,5a06cb57-9553-46f9-ace2-fcfddbcdc753,Mammalia,Rodentia,Sciuridae,Neotamias,NA,Neotamias Species,NA,2023-08-10T08:23:21Z,1,NA,NA,NA,NA,NA,NA,FALSE,NA,NA,CC-BY,"{""{\""detectionBox\"":[0.423722506,0.265272051,0.979222238,0.469383687]}""}",Mammal,SA_WI,Neotamias Species,Chipmunk Species,Neotamias Species,Neotamias Species,NA,2,0
2002875,SAHE1,77,SA,8/10/2023,6/13/2023,8/28/2023,2023,SA-SAHE1-2023,0,5a06cb57-9553-46f9-ace2-fcfddbcdc753,Mammalia,Rodentia,Sciuridae,Neotamias,NA,Neotamias Species,NA,2023-08-10T08:23:22Z,1,NA,NA,NA,NA,NA,NA,FALSE,NA,NA,CC-BY,"{""{\""detectionBox\"":[0.625412762,0.162200138,0.973352,0.517166138]}""}",Mammal,SA_WI,Neotamias Species,Chipmunk Species,Neotamias Species,Neotamias Species,NA,2,0
2002875,SAHE2,77,SA,8/10/2023,6/13/2023,8/28/2023,2023,SA-SAHE2-2023,0,5a06cb57-9553-46f9-ace2-fcfddbcdc753,Mammalia,Rodentia,Sciuridae,Neotamias,NA,Neotamias Species,NA,2023-08-10T08:23:24Z,1,NA,NA,NA,NA,NA,NA,FALSE,NA,NA,CC-BY,NA,Mammal,SA_WI,Neotamias Species,Chipmunk Species,Neotamias Species,Neotamias Species,NA,2,0
2002875,SAHE3,77,SA,8/10/2023,6/13/2023,8/28/2023,2023,SA-SAHE3-2023,0,5a06cb57-9553-46f9-ace2-fcfddbcdc753,Mammalia,Rodentia,Sciuridae,Neotamias,NA,Neotamias Species,NA,2023-08-10T08:23:27Z,1,NA,NA,NA,NA,NA,NA,FALSE,NA,NA,CC-BY,NA,Mammal,SA_WI,Neotamias Species,Chipmunk Species,Neotamias Species,Neotamias Species,NA,2,0
2002875,SAHE1,77,SA,8/10/2023,6/13/2023,8/28/2023,2023,SA-SAHE1-2023,0,5a06cb57-9553-46f9-ace2-fcfddbcdc753,Mammalia,Rodentia,Sciuridae,Neotamias,NA,Neotamias Species,NA,2023-08-10T08:23:27Z,1,NA,NA,NA,NA,NA,NA,FALSE,NA,NA,CC-BY,NA,Mammal,SA_WI,Neotamias Species,Chipmunk Species,Neotamias Species,Neotamias Species,NA,2,0
2002875,SAHE2,77,SA,8/10/2023,6/13/2023,8/28/2023,2023,SA-SAHE2-2023,0,5a06cb57-9553-46f9-ace2-fcfddbcdc753,Mammalia,Rodentia,Sciuridae,Neotamias,NA,Neotamias Species,NA,2023-08-10T08:23:28Z,1,NA,NA,NA,NA,NA,NA,FALSE,NA,NA,CC-BY,NA,Mammal,SA_WI,Neotamias Species,Chipmunk Species,Neotamias Species,Neotamias Species,NA,2,0
2002875,SAHE3,77,SA,6/24/2023,6/13/2023,8/28/2023,2023,SA-SAHE3-2023,0,26a96746-25c9-406e-b3a1-1658f81ae0af,Mammalia,Eulipotyphla,Soricidae,NA,NA,Soricidae Family,NA,2023-06-24T00:34:51Z,1,NA,NA,NA,NA,NA,NA,FALSE,NA,NA,CC-BY,NA,Mammal,SA_WI,Soricidae Family,Shrew Family,Soricidae Family,Soricidae Family,NA,2,0
2002875,SAHE1,77,SA,8/10/2023,6/13/2023,8/28/2023,2023,SA-SAHE1-2023,0,5a06cb57-9553-46f9-ace2-fcfddbcdc753,Mammalia,Rodentia,Sciuridae,Neotamias,NA,Neotamias Species,NA,2023-08-10T08:23:30Z,1,NA,NA,NA,NA,NA,NA,FALSE,NA,NA,CC-BY,NA,Mammal,SA_WI,Neotamias Species,Chipmunk Species,Neotamias Species,Neotamias Species,NA,2,0
2002875,SAHE2,77,SA,8/10/2023,6/13/2023,8/28/2023,2023,SA-SAHE2-2023,0,5a06cb57-9553-46f9-ace2-fcfddbcdc753,Mammalia,Rodentia,Sciuridae,Neotamias,NA,Neotamias Species,NA,2023-08-10T08:23:30Z,1,NA,NA,NA,NA,NA,NA,FALSE,NA,NA,CC-BY,NA,Mammal,SA_WI,Neotamias Species,Chipmunk Species,Neotamias Species,Neotamias Species,NA,2,0
2002875,SAHE3,77,SA,8/10/2023,6/13/2023,8/28/2023,2023,SA-SAHE3-2023,0,5a06cb57-9553-46f9-ace2-fcfddbcdc753,Mammalia,Rodentia,Sciuridae,Neotamias,NA,Neotamias Species,NA,2023-08-10T08:23:31Z,1,NA,NA,NA,NA,NA,NA,FALSE,NA,NA,CC-BY,NA,Mammal,SA_WI,Neotamias Species,Chipmunk Species,Neotamias Species,Neotamias Species,NA,2,0
2002875,SAHE1,77,SA,8/10/2023,6/13/2023,8/28/2023,2023,SA-SAHE1-2023,0,5a06cb57-9553-46f9-ace2-fcfddbcdc753,Mammalia,Rodentia,Sciuridae,Neotamias,NA,Neotamias Species,NA,2023-08-10T08:23:32Z,1,NA,NA,NA,NA,NA,NA,FALSE,NA,NA,CC-BY,"{""{\""detectionBox\"":[0.427245766,0.1806539,0.9740991,0.716240168]}""}",Mammal,SA_WI,Neotamias Species,Chipmunk Species,Neotamias Species,Neotamias Species,NA,2,0
2002875,SAHE2,77,SA,8/10/2023,6/13/2023,8/28/2023,2023,SA-SAHE2-2023,0,5a06cb57-9553-46f9-ace2-fcfddbcdc753,Mammalia,Rodentia,Sciuridae,Neotamias,NA,Neotamias Species,NA,2023-08-10T08:23:32Z,1,NA,NA,NA,NA,NA,NA,FALSE,NA,NA,CC-BY,NA,Mammal,SA_WI,Neotamias Species,Chipmunk Species,Neotamias Species,Neotamias Species,NA,2,0
2002875,SAHE3,77,SA,8/10/2023,6/13/2023,8/28/2023,2023,SA-SAHE3-2023,0,5a06cb57-9553-46f9-ace2-fcfddbcdc753,Mammalia,Rodentia,Sciuridae,Neotamias,NA,Neotamias Species,NA,2023-08-10T08:24:07Z,1,NA,NA,NA,NA,NA,NA,FALSE,NA,NA,CC-BY,"{""{\""detectionBox\"":[0.370874196,0.340771914,0.980465829,0.582470834]}""}",Mammal,SA_WI,Neotamias Species,Chipmunk Species,Neotamias Species,Neotamias Species,NA,2,0
2002875,SAHE1,77,SA,8/10/2023,6/13/2023,8/28/2023,2023,SA-SAHE1-2023,0,5a06cb57-9553-46f9-ace2-fcfddbcdc753,Mammalia,Rodentia,Sciuridae,Neotamias,NA,Neotamias Species,NA,2023-08-10T08:24:07Z,1,NA,NA,NA,NA,NA,NA,FALSE,NA,NA,CC-BY,NA,Mammal,SA_WI,Neotamias Species,Chipmunk Species,Neotamias Species,Neotamias Species,NA,2,0
2002875,SAHE2,77,SA,6/24/2023,6/13/2023,8/28/2023,2023,SA-SAHE2-2023,0,26a96746-25c9-406e-b3a1-1658f81ae0af,Mammalia,Eulipotyphla,Soricidae,NA,NA,Soricidae Family,NA,2023-06-24T00:34:52Z,1,NA,NA,NA,NA,NA,NA,FALSE,NA,NA,CC-BY,NA,Mammal,SA_WI,Soricidae Family,Shrew Family,Soricidae Family,Soricidae Family,NA,2,0
2002875,SAHE3,77,SA,8/10/2023,6/13/2023,8/28/2023,2023,SA-SAHE3-2023,0,5a06cb57-9553-46f9-ace2-fcfddbcdc753,Mammalia,Rodentia,Sciuridae,Neotamias,NA,Neotamias Species,NA,2023-08-10T10:41:32Z,1,NA,NA,NA,NA,NA,NA,FALSE,NA,NA,CC-BY,NA,Mammal,SA_WI,Neotamias Species,Chipmunk Species,Neotamias Species,Neotamias Species,NA,2,0
2002875,SAHE1,77,SA,8/10/2023,6/13/2023,8/28/2023,2023,SA-SAHE1-2023,0,5a06cb57-9553-46f9-ace2-fcfddbcdc753,Mammalia,Rodentia,Sciuridae,Neotamias,NA,Neotamias Species,NA,2023-08-10T10:41:33Z,1,NA,NA,NA,NA,NA,NA,FALSE,NA,NA,CC-BY,NA,Mammal,SA_WI,Neotamias Species,Chipmunk Species,Neotamias Species,Neotamias Species,NA,2,0
2002875,SAHE2,77,SA,8/10/2023,6/13/2023,8/28/2023,2023,SA-SAHE2-2023,0,5a06cb57-9553-46f9-ace2-fcfddbcdc753,Mammalia,Rodentia,Sciuridae,Neotamias,NA,Neotamias Species,NA,2023-08-10T14:20:45Z,1,NA,NA,NA,NA,NA,NA,FALSE,NA,NA,CC-BY,NA,Mammal,SA_WI,Neotamias Species,Chipmunk Species,Neotamias Species,Neotamias Species,NA,2,0
2002875,SAHE3,77,SA,8/10/2023,6/13/2023,8/28/2023,2023,SA-SAHE3-2023,0,5a06cb57-9553-46f9-ace2-fcfddbcdc753,Mammalia,Rodentia,Sciuridae,Neotamias,NA,Neotamias Species,NA,2023-08-10T14:20:45Z,1,NA,NA,NA,NA,NA,NA,FALSE,NA,NA,CC-BY,NA,Mammal,SA_WI,Neotamias Species,Chipmunk Species,Neotamias Species,Neotamias Species,NA,2,0
2002875,SAHE1,77,SA,8/10/2023,6/13/2023,8/28/2023,2023,SA-SAHE1-2023,0,26a96746-25c9-406e-b3a1-1658f81ae0af,Mammalia,Eulipotyphla,Soricidae,NA,NA,Soricidae Family,NA,2023-08-10T23:17:27Z,1,NA,NA,NA,NA,NA,NA,FALSE,NA,NA,CC-BY,NA,Mammal,SA_WI,Soricidae Family,Shrew Family,Soricidae Family,Soricidae Family,NA,2,0
2002875,SAHE2,77,SA,8/10/2023,6/13/2023,8/28/2023,2023,SA-SAHE2-2023,0,26a96746-25c9-406e-b3a1-1658f81ae0af,Mammalia,Eulipotyphla,Soricidae,NA,NA,Soricidae Family,NA,2023-08-10T23:17:27Z,1,NA,NA,NA,NA,NA,NA,FALSE,NA,NA,CC-BY,NA,Mammal,SA_WI,Soricidae Family,Shrew Family,Soricidae Family,Soricidae Family,NA,2,0
2002875,SAHE3,77,SA,8/10/2023,6/13/2023,8/28/2023,2023,SA-SAHE3-2023,0,26a96746-25c9-406e-b3a1-1658f81ae0af,Mammalia,Eulipotyphla,Soricidae,NA,NA,Soricidae Family,NA,2023-08-10T23:17:28Z,1,NA,NA,NA,NA,NA,NA,FALSE,NA,NA,CC-BY,NA,Mammal,SA_WI,Soricidae Family,Shrew Family,Soricidae Family,Soricidae Family,NA,2,0
2002875,SAHE1,77,SA,8/10/2023,6/13/2023,8/28/2023,2023,SA-SAHE1-2023,0,26a96746-25c9-406e-b3a1-1658f81ae0af,Mammalia,Eulipotyphla,Soricidae,NA,NA,Soricidae Family,NA,2023-08-10T23:17:29Z,1,NA,NA,NA,NA,NA,NA,FALSE,NA,NA,CC-BY,NA,Mammal,SA_WI,Soricidae Family,Shrew Family,Soricidae Family,Soricidae Family,NA,2,0
2002875,SAHE2,77,SA,8/10/2023,6/13/2023,8/28/2023,2023,SA-SAHE2-2023,0,26a96746-25c9-406e-b3a1-1658f81ae0af,Mammalia,Eulipotyphla,Soricidae,NA,NA,Soricidae Family,NA,2023-08-10T23:17:29Z,1,NA,NA,NA,NA,NA,NA,FALSE,NA,NA,CC-BY,NA,Mammal,SA_WI,Soricidae Family,Shrew Family,Soricidae Family,Soricidae Family,NA,2,0
2002875,SAHE3,77,SA,8/10/2023,6/13/2023,8/28/2023,2023,SA-SAHE3-2023,0,26a96746-25c9-406e-b3a1-1658f81ae0af,Mammalia,Eulipotyphla,Soricidae,NA,NA,Soricidae Family,NA,2023-08-10T23:17:30Z,1,NA,NA,NA,NA,NA,NA,FALSE,NA,NA,CC-BY,NA,Mammal,SA_WI,Soricidae Family,Shrew Family,Soricidae Family,Soricidae Family,NA,2,0
2002875,SAHE1,77,SA,8/10/2023,6/13/2023,8/28/2023,2023,SA-SAHE1-2023,0,26a96746-25c9-406e-b3a1-1658f81ae0af,Mammalia,Eulipotyphla,Soricidae,NA,NA,Soricidae Family,NA,2023-08-10T23:58:42Z,1,NA,NA,NA,NA,NA,NA,FALSE,NA,NA,CC-BY,NA,Mammal,SA_WI,Soricidae Family,Shrew Family,Soricidae Family,Soricidae Family,NA,2,0
2002875,SAHE2,77,SA,8/10/2023,6/13/2023,8/28/2023,2023,SA-SAHE2-2023,0,26a96746-25c9-406e-b3a1-1658f81ae0af,Mammalia,Eulipotyphla,Soricidae,NA,NA,Soricidae Family,NA,2023-08-10T23:58:42Z,1,NA,NA,NA,NA,NA,NA,FALSE,NA,NA,CC-BY,NA,Mammal,SA_WI,Soricidae Family,Shrew Family,Soricidae Family,Soricidae Family,NA,2,0
2002875,SAHE3,77,SA,8/10/2023,6/13/2023,8/28/2023,2023,SA-SAHE3-2023,0,26a96746-25c9-406e-b3a1-1658f81ae0af,Mammalia,Eulipotyphla,Soricidae,NA,NA,Soricidae Family,NA,2023-08-10T23:58:43Z,1,NA,NA,NA,NA,NA,NA,FALSE,NA,NA,CC-BY,NA,Mammal,SA_WI,Soricidae Family,Shrew Family,Soricidae Family,Soricidae Family,NA,2,0
2002875,SAHE1,77,SA,8/10/2023,6/13/2023,8/28/2023,2023,SA-SAHE1-2023,0,26a96746-25c9-406e-b3a1-1658f81ae0af,Mammalia,Eulipotyphla,Soricidae,NA,NA,Soricidae Family,NA,2023-08-10T23:58:44Z,1,NA,NA,NA,NA,NA,NA,FALSE,NA,NA,CC-BY,NA,Mammal,SA_WI,Soricidae Family,Shrew Family,Soricidae Family,Soricidae Family,NA,2,0
2002875,SAHE2,77,SA,8/10/2023,6/13/2023,8/28/2023,2023,SA-SAHE2-2023,0,26a96746-25c9-406e-b3a1-1658f81ae0af,Mammalia,Eulipotyphla,Soricidae,NA,NA,Soricidae Family,NA,2023-08-10T23:58:45Z,1,NA,NA,NA,NA,NA,NA,FALSE,NA,NA,CC-BY,NA,Mammal,SA_WI,Soricidae Family,Shrew Family,Soricidae Family,Soricidae Family,NA,2,0
2002875,SAHE3,77,SA,8/10/2023,6/13/2023,8/28/2023,2023,SA-SAHE3-2023,0,26a96746-25c9-406e-b3a1-1658f81ae0af,Mammalia,Eulipotyphla,Soricidae,NA,NA,Soricidae Family,NA,2023-08-10T23:58:45Z,1,NA,NA,NA,NA,NA,NA,FALSE,NA,NA,CC-BY,NA,Mammal,SA_WI,Soricidae Family,Shrew Family,Soricidae Family,Soricidae Family,NA,2,0
2002875,SAHE1,77,SA,8/10/2023,6/13/2023,8/28/2023,2023,SA-SAHE1-2023,0,26a96746-25c9-406e-b3a1-1658f81ae0af,Mammalia,Eulipotyphla,Soricidae,NA,NA,Soricidae Family,NA,2023-08-10T23:58:46Z,1,NA,NA,NA,NA,NA,NA,FALSE,NA,NA,CC-BY,NA,Mammal,SA_WI,Soricidae Family,Shrew Family,Soricidae Family,Soricidae Family,NA,2,0
2002875,SAHE2,77,SA,8/10/2023,6/13/2023,8/28/2023,2023,SA-SAHE2-2023,0,26a96746-25c9-406e-b3a1-1658f81ae0af,Mammalia,Eulipotyphla,Soricidae,NA,NA,Soricidae Family,NA,2023-08-10T23:58:48Z,1,NA,NA,NA,NA,NA,NA,FALSE,NA,NA,CC-BY,NA,Mammal,SA_WI,Soricidae Family,Shrew Family,Soricidae Family,Soricidae Family,NA,2,0
2002875,SAHE3,77,SA,8/11/2023,6/13/2023,8/28/2023,2023,SA-SAHE3-2023,0,5a06cb57-9553-46f9-ace2-fcfddbcdc753,Mammalia,Rodentia,Sciuridae,Neotamias,NA,Neotamias Species,NA,2023-08-11T08:22:16Z,1,NA,NA,NA,NA,NA,NA,FALSE,NA,NA,CC-BY,NA,Mammal,SA_WI,Neotamias Species,Chipmunk Species,Neotamias Species,Neotamias Species,NA,2,0
2002875,SAHE1,77,SA,8/11/2023,6/13/2023,8/28/2023,2023,SA-SAHE1-2023,0,5a06cb57-9553-46f9-ace2-fcfddbcdc753,Mammalia,Rodentia,Sciuridae,Neotamias,NA,Neotamias Species,NA,2023-08-11T12:54:11Z,1,NA,NA,NA,NA,NA,NA,FALSE,NA,NA,CC-BY,NA,Mammal,SA_WI,Neotamias Species,Chipmunk Species,Neotamias Species,Neotamias Species,NA,2,0
2002875,SAHE2,77,SA,8/11/2023,6/13/2023,8/28/2023,2023,SA-SAHE2-2023,0,5a06cb57-9553-46f9-ace2-fcfddbcdc753,Mammalia,Rodentia,Sciuridae,Neotamias,NA,Neotamias Species,NA,2023-08-11T12:54:11Z,1,NA,NA,NA,NA,NA,NA,FALSE,NA,NA,CC-BY,NA,Mammal,SA_WI,Neotamias Species,Chipmunk Species,Neotamias Species,Neotamias Species,NA,2,0
2002875,SAHE3,77,SA,8/11/2023,6/13/2023,8/28/2023,2023,SA-SAHE3-2023,0,5a06cb57-9553-46f9-ace2-fcfddbcdc753,Mammalia,Rodentia,Sciuridae,Neotamias,NA,Neotamias Species,NA,2023-08-11T12:54:12Z,1,NA,NA,NA,NA,NA,NA,FALSE,NA,NA,CC-BY,NA,Mammal,SA_WI,Neotamias Species,Chipmunk Species,Neotamias Species,Neotamias Species,NA,2,0
2002875,SAHE1,77,SA,8/11/2023,6/13/2023,8/28/2023,2023,SA-SAHE1-2023,0,5a06cb57-9553-46f9-ace2-fcfddbcdc753,Mammalia,Rodentia,Sciuridae,Neotamias,NA,Neotamias Species,NA,2023-08-11T12:54:13Z,1,NA,NA,NA,NA,NA,NA,FALSE,NA,NA,CC-BY,NA,Mammal,SA_WI,Neotamias Species,Chipmunk Species,Neotamias Species,Neotamias Species,NA,2,0
2002875,SAHE2,77,SA,8/11/2023,6/13/2023,8/28/2023,2023,SA-SAHE2-2023,0,5a06cb57-9553-46f9-ace2-fcfddbcdc753,Mammalia,Rodentia,Sciuridae,Neotamias,NA,Neotamias Species,NA,2023-08-11T12:54:13Z,1,NA,NA,NA,NA,NA,NA,FALSE,NA,NA,CC-BY,NA,Mammal,SA_WI,Neotamias Species,Chipmunk Species,Neotamias Species,Neotamias Species,NA,2,0
2002875,SAHE3,77,SA,8/11/2023,6/13/2023,8/28/2023,2023,SA-SAHE3-2023,0,5a06cb57-9553-46f9-ace2-fcfddbcdc753,Mammalia,Rodentia,Sciuridae,Neotamias,NA,Neotamias Species,NA,2023-08-11T12:54:14Z,1,NA,NA,NA,NA,NA,NA,FALSE,NA,NA,CC-BY,NA,Mammal,SA_WI,Neotamias Species,Chipmunk Species,Neotamias Species,Neotamias Species,NA,2,0
2002875,SAHE1,77,SA,8/11/2023,6/13/2023,8/28/2023,2023,SA-SAHE1-2023,0,5a06cb57-9553-46f9-ace2-fcfddbcdc753,Mammalia,Rodentia,Sciuridae,Neotamias,NA,Neotamias Species,NA,2023-08-11T12:54:16Z,1,NA,NA,NA,NA,NA,NA,FALSE,NA,NA,CC-BY,"{""{\""detectionBox\"":[0.543731928,0.0150506794,0.973907411,0.528698683]}""}",Mammal,SA_WI,Neotamias Species,Chipmunk Species,Neotamias Species,Neotamias Species,NA,2,0
2002875,SAHE2,77,SA,8/11/2023,6/13/2023,8/28/2023,2023,SA-SAHE2-2023,0,5a06cb57-9553-46f9-ace2-fcfddbcdc753,Mammalia,Rodentia,Sciuridae,Neotamias,NA,Neotamias Species,NA,2023-08-11T12:54:16Z,1,NA,NA,NA,NA,NA,NA,FALSE,NA,NA,CC-BY,"{""{\""detectionBox\"":[0.542179823,0.0214774609,0.968647897,0.598533809]}""}",Mammal,SA_WI,Neotamias Species,Chipmunk Species,Neotamias Species,Neotamias Species,NA,2,0
2002875,SAHE3,77,SA,8/11/2023,6/13/2023,8/28/2023,2023,SA-SAHE3-2023,0,5a06cb57-9553-46f9-ace2-fcfddbcdc753,Mammalia,Rodentia,Sciuridae,Neotamias,NA,Neotamias Species,NA,2023-08-11T12:54:17Z,1,NA,NA,NA,NA,NA,NA,FALSE,NA,NA,CC-BY,NA,Mammal,SA_WI,Neotamias Species,Chipmunk Species,Neotamias Species,Neotamias Species,NA,2,0
2002875,SAHE1,77,SA,8/11/2023,6/13/2023,8/28/2023,2023,SA-SAHE1-2023,0,5a06cb57-9553-46f9-ace2-fcfddbcdc753,Mammalia,Rodentia,Sciuridae,Neotamias,NA,Neotamias Species,NA,2023-08-11T12:54:19Z,1,NA,NA,NA,NA,NA,NA,FALSE,NA,NA,CC-BY,NA,Mammal,SA_WI,Neotamias Species,Chipmunk Species,Neotamias Species,Neotamias Species,NA,2,0
2002875,SAHE2,77,SA,8/11/2023,6/13/2023,8/28/2023,2023,SA-SAHE2-2023,0,5a06cb57-9553-46f9-ace2-fcfddbcdc753,Mammalia,Rodentia,Sciuridae,Neotamias,NA,Neotamias Species,NA,2023-08-11T12:54:19Z,1,NA,NA,NA,NA,NA,NA,FALSE,NA,NA,CC-BY,NA,Mammal,SA_WI,Neotamias Species,Chipmunk Species,Neotamias Species,Neotamias Species,NA,2,0
2002875,SAHE3,77,SA,8/11/2023,6/13/2023,8/28/2023,2023,SA-SAHE3-2023,0,5a06cb57-9553-46f9-ace2-fcfddbcdc753,Mammalia,Rodentia,Sciuridae,Neotamias,NA,Neotamias Species,NA,2023-08-11T12:54:20Z,1,NA,NA,NA,NA,NA,NA,FALSE,NA,NA,CC-BY,NA,Mammal,SA_WI,Neotamias Species,Chipmunk Species,Neotamias Species,Neotamias Species,NA,2,0
2002875,SAHE1,77,SA,8/11/2023,6/13/2023,8/28/2023,2023,SA-SAHE1-2023,0,5a06cb57-9553-46f9-ace2-fcfddbcdc753,Mammalia,Rodentia,Sciuridae,Neotamias,NA,Neotamias Species,NA,2023-08-11T12:54:21Z,1,NA,NA,NA,NA,NA,NA,FALSE,NA,NA,CC-BY,NA,Mammal,SA_WI,Neotamias Species,Chipmunk Species,Neotamias Species,Neotamias Species,NA,2,0
2002875,SAHE2,77,SA,8/11/2023,6/13/2023,8/28/2023,2023,SA-SAHE2-2023,0,5a06cb57-9553-46f9-ace2-fcfddbcdc753,Mammalia,Rodentia,Sciuridae,Neotamias,NA,Neotamias Species,NA,2023-08-11T12:54:21Z,1,NA,NA,NA,NA,NA,NA,FALSE,NA,NA,CC-BY,NA,Mammal,SA_WI,Neotamias Species,Chipmunk Species,Neotamias Species,Neotamias Species,NA,2,0
2002875,SAHE3,77,SA,8/11/2023,6/13/2023,8/28/2023,2023,SA-SAHE3-2023,0,5a06cb57-9553-46f9-ace2-fcfddbcdc753,Mammalia,Rodentia,Sciuridae,Neotamias,NA,Neotamias Species,NA,2023-08-11T12:54:22Z,1,NA,NA,NA,NA,NA,NA,FALSE,NA,NA,CC-BY,"{""{\""detectionBox\"":[0.627414644,0.266738892,0.988211095,0.875213861]}""}",Mammal,SA_WI,Neotamias Species,Chipmunk Species,Neotamias Species,Neotamias Species,NA,2,0
2002875,SAHE1,77,SA,8/11/2023,6/13/2023,8/28/2023,2023,SA-SAHE1-2023,0,5a06cb57-9553-46f9-ace2-fcfddbcdc753,Mammalia,Rodentia,Sciuridae,Neotamias,NA,Neotamias Species,NA,2023-08-11T12:54:23Z,1,NA,NA,NA,NA,NA,NA,FALSE,NA,NA,CC-BY,NA,Mammal,SA_WI,Neotamias Species,Chipmunk Species,Neotamias Species,Neotamias Species,NA,2,0
2002875,SAHE2,77,SA,8/11/2023,6/13/2023,8/28/2023,2023,SA-SAHE2-2023,0,5a06cb57-9553-46f9-ace2-fcfddbcdc753,Mammalia,Rodentia,Sciuridae,Neotamias,NA,Neotamias Species,NA,2023-08-11T12:54:24Z,1,NA,NA,NA,NA,NA,NA,FALSE,NA,NA,CC-BY,NA,Mammal,SA_WI,Neotamias Species,Chipmunk Species,Neotamias Species,Neotamias Species,NA,2,0
2002875,SAHE3,77,SA,8/11/2023,6/13/2023,8/28/2023,2023,SA-SAHE3-2023,0,5a06cb57-9553-46f9-ace2-fcfddbcdc753,Mammalia,Rodentia,Sciuridae,Neotamias,NA,Neotamias Species,NA,2023-08-11T12:54:24Z,1,NA,NA,NA,NA,NA,NA,FALSE,NA,NA,CC-BY,NA,Mammal,SA_WI,Neotamias Species,Chipmunk Species,Neotamias Species,Neotamias Species,NA,2,0
2002875,SAHE1,77,SA,8/11/2023,6/13/2023,8/28/2023,2023,SA-SAHE1-2023,0,5a06cb57-9553-46f9-ace2-fcfddbcdc753,Mammalia,Rodentia,Sciuridae,Neotamias,NA,Neotamias Species,NA,2023-08-11T13:47:49Z,1,NA,NA,NA,NA,NA,NA,FALSE,NA,NA,CC-BY,NA,Mammal,SA_WI,Neotamias Species,Chipmunk Species,Neotamias Species,Neotamias Species,NA,2,0
2002875,SAHE2,77,SA,8/11/2023,6/13/2023,8/28/2023,2023,SA-SAHE2-2023,0,5a06cb57-9553-46f9-ace2-fcfddbcdc753,Mammalia,Rodentia,Sciuridae,Neotamias,NA,Neotamias Species,NA,2023-08-11T13:47:49Z,1,NA,NA,NA,NA,NA,NA,FALSE,NA,NA,CC-BY,NA,Mammal,SA_WI,Neotamias Species,Chipmunk Species,Neotamias Species,Neotamias Species,NA,2,0
2002875,SAHE3,77,SA,8/11/2023,6/13/2023,8/28/2023,2023,SA-SAHE3-2023,0,5a06cb57-9553-46f9-ace2-fcfddbcdc753,Mammalia,Rodentia,Sciuridae,Neotamias,NA,Neotamias Species,NA,2023-08-11T13:47:50Z,1,NA,NA,NA,NA,NA,NA,FALSE,NA,NA,CC-BY,NA,Mammal,SA_WI,Neotamias Species,Chipmunk Species,Neotamias Species,Neotamias Species,NA,2,0
2002875,SAHE1,77,SA,8/11/2023,6/13/2023,8/28/2023,2023,SA-SAHE1-2023,0,5a06cb57-9553-46f9-ace2-fcfddbcdc753,Mammalia,Rodentia,Sciuridae,Neotamias,NA,Neotamias Species,NA,2023-08-11T17:37:30Z,1,NA,NA,NA,NA,NA,NA,FALSE,NA,NA,CC-BY,"{""{\""detectionBox\"":[0.710293055,0.194564626,0.979548693,0.629616141]}""}",Mammal,SA_WI,Neotamias Species,Chipmunk Species,Neotamias Species,Neotamias Species,NA,2,0
2002875,SAHE2,77,SA,8/11/2023,6/13/2023,8/28/2023,2023,SA-SAHE2-2023,0,5a06cb57-9553-46f9-ace2-fcfddbcdc753,Mammalia,Rodentia,Sciuridae,Neotamias,NA,Neotamias Species,NA,2023-08-11T17:37:31Z,1,NA,NA,NA,NA,NA,NA,FALSE,NA,NA,CC-BY,NA,Mammal,SA_WI,Neotamias Species,Chipmunk Species,Neotamias Species,Neotamias Species,NA,2,0
2002875,SAHE3,77,SA,8/11/2023,6/13/2023,8/28/2023,2023,SA-SAHE3-2023,0,26a96746-25c9-406e-b3a1-1658f81ae0af,Mammalia,Eulipotyphla,Soricidae,NA,NA,Soricidae Family,NA,2023-08-11T21:29:47Z,1,NA,NA,NA,NA,NA,NA,FALSE,NA,NA,CC-BY,NA,Mammal,SA_WI,Soricidae Family,Shrew Family,Soricidae Family,Soricidae Family,NA,2,0
2002875,SAHE1,77,SA,8/11/2023,6/13/2023,8/28/2023,2023,SA-SAHE1-2023,0,26a96746-25c9-406e-b3a1-1658f81ae0af,Mammalia,Eulipotyphla,Soricidae,NA,NA,Soricidae Family,NA,2023-08-11T21:29:48Z,1,NA,NA,NA,NA,NA,NA,FALSE,NA,NA,CC-BY,NA,Mammal,SA_WI,Soricidae Family,Shrew Family,Soricidae Family,Soricidae Family,NA,2,0
2002875,SAHE2,77,SA,8/11/2023,6/13/2023,8/28/2023,2023,SA-SAHE2-2023,0,26a96746-25c9-406e-b3a1-1658f81ae0af,Mammalia,Eulipotyphla,Soricidae,NA,NA,Soricidae Family,NA,2023-08-11T21:29:49Z,1,NA,NA,NA,NA,NA,NA,FALSE,NA,NA,CC-BY,"{""{\""detectionBox\"":[0.801817656,0.585402489,0.983067334,0.840839505]}""}",Mammal,SA_WI,Soricidae Family,Shrew Family,Soricidae Family,Soricidae Family,NA,2,0
2002875,SAHE3,77,SA,8/11/2023,6/13/2023,8/28/2023,2023,SA-SAHE3-2023,0,26a96746-25c9-406e-b3a1-1658f81ae0af,Mammalia,Eulipotyphla,Soricidae,NA,NA,Soricidae Family,NA,2023-08-11T21:29:51Z,1,NA,NA,NA,NA,NA,NA,FALSE,NA,NA,CC-BY,NA,Mammal,SA_WI,Soricidae Family,Shrew Family,Soricidae Family,Soricidae Family,NA,2,0
2002875,SAHE1,77,SA,8/11/2023,6/13/2023,8/28/2023,2023,SA-SAHE1-2023,0,26a96746-25c9-406e-b3a1-1658f81ae0af,Mammalia,Eulipotyphla,Soricidae,NA,NA,Soricidae Family,NA,2023-08-11T21:29:51Z,1,NA,NA,NA,NA,NA,NA,FALSE,NA,NA,CC-BY,NA,Mammal,SA_WI,Soricidae Family,Shrew Family,Soricidae Family,Soricidae Family,NA,2,0
2002875,SAHE2,77,SA,8/11/2023,6/13/2023,8/28/2023,2023,SA-SAHE2-2023,0,26a96746-25c9-406e-b3a1-1658f81ae0af,Mammalia,Eulipotyphla,Soricidae,NA,NA,Soricidae Family,NA,2023-08-11T21:29:55Z,1,NA,NA,NA,NA,NA,NA,FALSE,NA,NA,CC-BY,NA,Mammal,SA_WI,Soricidae Family,Shrew Family,Soricidae Family,Soricidae Family,NA,2,0
2002875,SAHE3,77,SA,8/11/2023,6/13/2023,8/28/2023,2023,SA-SAHE3-2023,0,26a96746-25c9-406e-b3a1-1658f81ae0af,Mammalia,Eulipotyphla,Soricidae,NA,NA,Soricidae Family,NA,2023-08-11T21:29:56Z,1,NA,NA,NA,NA,NA,NA,FALSE,NA,NA,CC-BY,NA,Mammal,SA_WI,Soricidae Family,Shrew Family,Soricidae Family,Soricidae Family,NA,2,0
2002875,SAHE1,77,SA,8/11/2023,6/13/2023,8/28/2023,2023,SA-SAHE1-2023,0,26a96746-25c9-406e-b3a1-1658f81ae0af,Mammalia,Eulipotyphla,Soricidae,NA,NA,Soricidae Family,NA,2023-08-11T21:30:04Z,1,NA,NA,NA,NA,NA,NA,FALSE,NA,NA,CC-BY,NA,Mammal,SA_WI,Soricidae Family,Shrew Family,Soricidae Family,Soricidae Family,NA,2,0
2002875,SAHE2,77,SA,8/11/2023,6/13/2023,8/28/2023,2023,SA-SAHE2-2023,0,26a96746-25c9-406e-b3a1-1658f81ae0af,Mammalia,Eulipotyphla,Soricidae,NA,NA,Soricidae Family,NA,2023-08-11T21:30:04Z,1,NA,NA,NA,NA,NA,NA,FALSE,NA,NA,CC-BY,NA,Mammal,SA_WI,Soricidae Family,Shrew Family,Soricidae Family,Soricidae Family,NA,2,0
2002875,SAHE3,77,SA,8/11/2023,6/13/2023,8/28/2023,2023,SA-SAHE3-2023,0,26a96746-25c9-406e-b3a1-1658f81ae0af,Mammalia,Eulipotyphla,Soricidae,NA,NA,Soricidae Family,NA,2023-08-11T21:30:05Z,1,NA,NA,NA,NA,NA,NA,FALSE,NA,NA,CC-BY,NA,Mammal,SA_WI,Soricidae Family,Shrew Family,Soricidae Family,Soricidae Family,NA,2,0
2002875,SAHE1,77,SA,8/11/2023,6/13/2023,8/28/2023,2023,SA-SAHE1-2023,0,adf63c9e-18c0-451a-a78f-4c29864bc1f5,Mammalia,Rodentia,NA,NA,NA,Mouse species,NA,2023-08-11T22:26:48Z,1,NA,NA,NA,NA,NA,NA,FALSE,NA,NA,CC-BY,NA,Mammal,SA_WI,Mouse Species,Mouse Species,Mouse Species,Mouse Species,NA,2,0
2002875,SAHE2,77,SA,8/11/2023,6/13/2023,8/28/2023,2023,SA-SAHE2-2023,0,adf63c9e-18c0-451a-a78f-4c29864bc1f5,Mammalia,Rodentia,NA,NA,NA,Mouse species,NA,2023-08-11T22:26:49Z,1,NA,NA,NA,NA,NA,NA,FALSE,NA,NA,CC-BY,NA,Mammal,SA_WI,Mouse Species,Mouse Species,Mouse Species,Mouse Species,NA,2,0
2002875,SAHE3,77,SA,8/11/2023,6/13/2023,8/28/2023,2023,SA-SAHE3-2023,0,adf63c9e-18c0-451a-a78f-4c29864bc1f5,Mammalia,Rodentia,NA,NA,NA,Mouse species,NA,2023-08-11T22:26:49Z,1,NA,NA,NA,NA,NA,NA,FALSE,NA,NA,CC-BY,"{""{\""detectionBox\"":[0.691423237,0.246616229,0.952374637,0.73560673]}""}",Mammal,SA_WI,Mouse Species,Mouse Species,Mouse Species,Mouse Species,NA,2,0
2002875,SAHE1,77,SA,8/11/2023,6/13/2023,8/28/2023,2023,SA-SAHE1-2023,0,adf63c9e-18c0-451a-a78f-4c29864bc1f5,Mammalia,Rodentia,NA,NA,NA,Mouse species,NA,2023-08-11T22:26:51Z,1,NA,NA,NA,NA,NA,NA,FALSE,NA,NA,CC-BY,NA,Mammal,SA_WI,Mouse Species,Mouse Species,Mouse Species,Mouse Species,NA,2,0
2002875,SAHE2,77,SA,8/11/2023,6/13/2023,8/28/2023,2023,SA-SAHE2-2023,0,adf63c9e-18c0-451a-a78f-4c29864bc1f5,Mammalia,Rodentia,NA,NA,NA,Mouse species,NA,2023-08-11T22:26:51Z,1,NA,NA,NA,NA,NA,NA,FALSE,NA,NA,CC-BY,NA,Mammal,SA_WI,Mouse Species,Mouse Species,Mouse Species,Mouse Species,NA,2,0
2002875,SAHE3,77,SA,8/11/2023,6/13/2023,8/28/2023,2023,SA-SAHE3-2023,0,adf63c9e-18c0-451a-a78f-4c29864bc1f5,Mammalia,Rodentia,NA,NA,NA,Mouse species,NA,2023-08-11T22:26:52Z,1,NA,NA,NA,NA,NA,NA,FALSE,NA,NA,CC-BY,NA,Mammal,SA_WI,Mouse Species,Mouse Species,Mouse Species,Mouse Species,NA,2,0
2002875,SAHE1,77,SA,8/11/2023,6/13/2023,8/28/2023,2023,SA-SAHE1-2023,0,adf63c9e-18c0-451a-a78f-4c29864bc1f5,Mammalia,Rodentia,NA,NA,NA,Mouse species,NA,2023-08-11T22:26:53Z,1,NA,NA,NA,NA,NA,NA,FALSE,NA,NA,CC-BY,NA,Mammal,SA_WI,Mouse Species,Mouse Species,Mouse Species,Mouse Species,NA,2,0
2002875,SAHE2,77,SA,8/11/2023,6/13/2023,8/28/2023,2023,SA-SAHE2-2023,0,adf63c9e-18c0-451a-a78f-4c29864bc1f5,Mammalia,Rodentia,NA,NA,NA,Mouse species,NA,2023-08-11T22:26:54Z,1,NA,NA,NA,NA,NA,NA,FALSE,NA,NA,CC-BY,NA,Mammal,SA_WI,Mouse Species,Mouse Species,Mouse Species,Mouse Species,NA,2,0
2002875,SAHE3,77,SA,8/11/2023,6/13/2023,8/28/2023,2023,SA-SAHE3-2023,0,adf63c9e-18c0-451a-a78f-4c29864bc1f5,Mammalia,Rodentia,NA,NA,NA,Mouse species,NA,2023-08-11T22:26:55Z,1,NA,NA,NA,NA,NA,NA,FALSE,NA,NA,CC-BY,NA,Mammal,SA_WI,Mouse Species,Mouse Species,Mouse Species,Mouse Species,NA,2,0
2002875,SAHE1,77,SA,8/11/2023,6/13/2023,8/28/2023,2023,SA-SAHE1-2023,0,adf63c9e-18c0-451a-a78f-4c29864bc1f5,Mammalia,Rodentia,NA,NA,NA,Mouse species,NA,2023-08-11T22:26:57Z,1,NA,NA,NA,NA,NA,NA,FALSE,NA,NA,CC-BY,NA,Mammal,SA_WI,Mouse Species,Mouse Species,Mouse Species,Mouse Species,NA,2,0
2002875,SAHE2,77,SA,8/11/2023,6/13/2023,8/28/2023,2023,SA-SAHE2-2023,0,adf63c9e-18c0-451a-a78f-4c29864bc1f5,Mammalia,Rodentia,NA,NA,NA,Mouse species,NA,2023-08-11T22:26:58Z,1,NA,NA,NA,NA,NA,NA,FALSE,NA,NA,CC-BY,NA,Mammal,SA_WI,Mouse Species,Mouse Species,Mouse Species,Mouse Species,NA,2,0
2002875,SAHE3,77,SA,8/11/2023,6/13/2023,8/28/2023,2023,SA-SAHE3-2023,0,adf63c9e-18c0-451a-a78f-4c29864bc1f5,Mammalia,Rodentia,NA,NA,NA,Mouse species,NA,2023-08-11T22:26:58Z,1,NA,NA,NA,NA,NA,NA,FALSE,NA,NA,CC-BY,"{""{\""detectionBox\"":[0.50518769,0.00202253461,0.949525654,0.202357309]}""}",Mammal,SA_WI,Mouse Species,Mouse Species,Mouse Species,Mouse Species,NA,2,0
2002875,SAHE1,77,SA,8/11/2023,6/13/2023,8/28/2023,2023,SA-SAHE1-2023,0,adf63c9e-18c0-451a-a78f-4c29864bc1f5,Mammalia,Rodentia,NA,NA,NA,Mouse species,NA,2023-08-11T22:27:00Z,1,NA,NA,NA,NA,NA,NA,FALSE,NA,NA,CC-BY,"{""{\""detectionBox\"":[0.231370211,0.00261507183,0.784292459,0.184141874]}""}",Mammal,SA_WI,Mouse Species,Mouse Species,Mouse Species,Mouse Species,NA,2,0
2002875,SAHE2,77,SA,8/11/2023,6/13/2023,8/28/2023,2023,SA-SAHE2-2023,0,adf63c9e-18c0-451a-a78f-4c29864bc1f5,Mammalia,Rodentia,NA,NA,NA,Mouse species,NA,2023-08-11T22:27:00Z,1,NA,NA,NA,NA,NA,NA,FALSE,NA,NA,CC-BY,"{""{\""detectionBox\"":[0.251570642,0,0.807442904,0.178156555]}""}",Mammal,SA_WI,Mouse Species,Mouse Species,Mouse Species,Mouse Species,NA,2,0
2002875,SAHE3,77,SA,8/11/2023,6/13/2023,8/28/2023,2023,SA-SAHE3-2023,0,adf63c9e-18c0-451a-a78f-4c29864bc1f5,Mammalia,Rodentia,NA,NA,NA,Mouse species,NA,2023-08-11T22:27:01Z,1,NA,NA,NA,NA,NA,NA,FALSE,NA,NA,CC-BY,NA,Mammal,SA_WI,Mouse Species,Mouse Species,Mouse Species,Mouse Species,NA,2,0
2002875,SAHE1,77,SA,8/12/2023,6/13/2023,8/28/2023,2023,SA-SAHE1-2023,0,26a96746-25c9-406e-b3a1-1658f81ae0af,Mammalia,Eulipotyphla,Soricidae,NA,NA,Soricidae Family,NA,2023-08-12T00:10:32Z,1,NA,NA,NA,NA,NA,NA,FALSE,NA,NA,CC-BY,NA,Mammal,SA_WI,Soricidae Family,Shrew Family,Soricidae Family,Soricidae Family,NA,2,0
2002875,SAHE2,77,SA,8/12/2023,6/13/2023,8/28/2023,2023,SA-SAHE2-2023,0,26a96746-25c9-406e-b3a1-1658f81ae0af,Mammalia,Eulipotyphla,Soricidae,NA,NA,Soricidae Family,NA,2023-08-12T00:10:33Z,1,NA,NA,NA,NA,NA,NA,FALSE,NA,NA,CC-BY,NA,Mammal,SA_WI,Soricidae Family,Shrew Family,Soricidae Family,Soricidae Family,NA,2,0
2002875,SAHE3,77,SA,8/12/2023,6/13/2023,8/28/2023,2023,SA-SAHE3-2023,0,26a96746-25c9-406e-b3a1-1658f81ae0af,Mammalia,Eulipotyphla,Soricidae,NA,NA,Soricidae Family,NA,2023-08-12T00:10:33Z,1,NA,NA,NA,NA,NA,NA,FALSE,NA,NA,CC-BY,NA,Mammal,SA_WI,Soricidae Family,Shrew Family,Soricidae Family,Soricidae Family,NA,2,0
2002875,SAHE1,77,SA,8/12/2023,6/13/2023,8/28/2023,2023,SA-SAHE1-2023,0,26a96746-25c9-406e-b3a1-1658f81ae0af,Mammalia,Eulipotyphla,Soricidae,NA,NA,Soricidae Family,NA,2023-08-12T00:10:35Z,1,NA,NA,NA,NA,NA,NA,FALSE,NA,NA,CC-BY,NA,Mammal,SA_WI,Soricidae Family,Shrew Family,Soricidae Family,Soricidae Family,NA,2,0
2002875,SAHE2,77,SA,8/12/2023,6/13/2023,8/28/2023,2023,SA-SAHE2-2023,0,26a96746-25c9-406e-b3a1-1658f81ae0af,Mammalia,Eulipotyphla,Soricidae,NA,NA,Soricidae Family,NA,2023-08-12T00:10:34Z,1,NA,NA,NA,NA,NA,NA,FALSE,NA,NA,CC-BY,NA,Mammal,SA_WI,Soricidae Family,Shrew Family,Soricidae Family,Soricidae Family,NA,2,0
2002875,SAHE3,77,SA,8/12/2023,6/13/2023,8/28/2023,2023,SA-SAHE3-2023,0,26a96746-25c9-406e-b3a1-1658f81ae0af,Mammalia,Eulipotyphla,Soricidae,NA,NA,Soricidae Family,NA,2023-08-12T00:10:35Z,1,NA,NA,NA,NA,NA,NA,FALSE,NA,NA,CC-BY,NA,Mammal,SA_WI,Soricidae Family,Shrew Family,Soricidae Family,Soricidae Family,NA,2,0
2002875,SAHE1,77,SA,8/12/2023,6/13/2023,8/28/2023,2023,SA-SAHE1-2023,0,adf63c9e-18c0-451a-a78f-4c29864bc1f5,Mammalia,Rodentia,NA,NA,NA,Mouse species,NA,2023-08-12T05:29:54Z,1,NA,NA,NA,NA,NA,NA,FALSE,NA,NA,CC-BY,"{""{\""detectionBox\"":[0.418616742,0.445708871,0.95291388,0.755180955]}""}",Mammal,SA_WI,Mouse Species,Mouse Species,Mouse Species,Mouse Species,NA,2,0
2002875,SAHE2,77,SA,8/12/2023,6/13/2023,8/28/2023,2023,SA-SAHE2-2023,0,adf63c9e-18c0-451a-a78f-4c29864bc1f5,Mammalia,Rodentia,NA,NA,NA,Mouse species,NA,2023-08-12T05:49:02Z,1,NA,NA,NA,NA,NA,NA,FALSE,NA,NA,CC-BY,NA,Mammal,SA_WI,Mouse Species,Mouse Species,Mouse Species,Mouse Species,NA,2,0
2002875,SAHE3,77,SA,6/25/2023,6/13/2023,8/28/2023,2023,SA-SAHE3-2023,0,26a96746-25c9-406e-b3a1-1658f81ae0af,Mammalia,Eulipotyphla,Soricidae,NA,NA,Soricidae Family,NA,2023-06-25T05:47:28Z,1,NA,NA,NA,NA,NA,NA,FALSE,NA,NA,CC-BY,NA,Mammal,SA_WI,Soricidae Family,Shrew Family,Soricidae Family,Soricidae Family,NA,2,0
2002875,SAHE1,77,SA,8/12/2023,6/13/2023,8/28/2023,2023,SA-SAHE1-2023,0,5a06cb57-9553-46f9-ace2-fcfddbcdc753,Mammalia,Rodentia,Sciuridae,Neotamias,NA,Neotamias Species,NA,2023-08-12T12:00:18Z,1,NA,NA,NA,NA,NA,NA,FALSE,NA,NA,CC-BY,NA,Mammal,SA_WI,Neotamias Species,Chipmunk Species,Neotamias Species,Neotamias Species,NA,2,0
2002875,SAHE2,77,SA,8/12/2023,6/13/2023,8/28/2023,2023,SA-SAHE2-2023,0,5a06cb57-9553-46f9-ace2-fcfddbcdc753,Mammalia,Rodentia,Sciuridae,Neotamias,NA,Neotamias Species,NA,2023-08-12T12:00:19Z,1,NA,NA,NA,NA,NA,NA,FALSE,NA,NA,CC-BY,NA,Mammal,SA_WI,Neotamias Species,Chipmunk Species,Neotamias Species,Neotamias Species,NA,2,0
2002875,SAHE3,77,SA,8/12/2023,6/13/2023,8/28/2023,2023,SA-SAHE3-2023,0,5a06cb57-9553-46f9-ace2-fcfddbcdc753,Mammalia,Rodentia,Sciuridae,Neotamias,NA,Neotamias Species,NA,2023-08-12T12:00:20Z,1,NA,NA,NA,NA,NA,NA,FALSE,NA,NA,CC-BY,NA,Mammal,SA_WI,Neotamias Species,Chipmunk Species,Neotamias Species,Neotamias Species,NA,2,0
2002875,SAHE1,77,SA,8/12/2023,6/13/2023,8/28/2023,2023,SA-SAHE1-2023,0,5a06cb57-9553-46f9-ace2-fcfddbcdc753,Mammalia,Rodentia,Sciuridae,Neotamias,NA,Neotamias Species,NA,2023-08-12T12:00:21Z,1,NA,NA,NA,NA,NA,NA,FALSE,NA,NA,CC-BY,NA,Mammal,SA_WI,Neotamias Species,Chipmunk Species,Neotamias Species,Neotamias Species,NA,2,0
2002875,SAHE2,77,SA,8/12/2023,6/13/2023,8/28/2023,2023,SA-SAHE2-2023,0,5a06cb57-9553-46f9-ace2-fcfddbcdc753,Mammalia,Rodentia,Sciuridae,Neotamias,NA,Neotamias Species,NA,2023-08-12T12:00:22Z,1,NA,NA,NA,NA,NA,NA,FALSE,NA,NA,CC-BY,NA,Mammal,SA_WI,Neotamias Species,Chipmunk Species,Neotamias Species,Neotamias Species,NA,2,0
2002875,SAHE3,77,SA,6/25/2023,6/13/2023,8/28/2023,2023,SA-SAHE3-2023,0,26a96746-25c9-406e-b3a1-1658f81ae0af,Mammalia,Eulipotyphla,Soricidae,NA,NA,Soricidae Family,NA,2023-06-25T05:47:29Z,1,NA,NA,NA,NA,NA,NA,FALSE,NA,NA,CC-BY,"{""{\""detectionBox\"":[0.50316447,0.294014633,0.881464124,0.453743398]}""}",Mammal,SA_WI,Soricidae Family,Shrew Family,Soricidae Family,Soricidae Family,NA,2,0
2002875,SAHE1,77,SA,8/12/2023,6/13/2023,8/28/2023,2023,SA-SAHE1-2023,0,5a06cb57-9553-46f9-ace2-fcfddbcdc753,Mammalia,Rodentia,Sciuridae,Neotamias,NA,Neotamias Species,NA,2023-08-12T14:15:55Z,1,NA,NA,NA,NA,NA,NA,FALSE,NA,NA,CC-BY,NA,Mammal,SA_WI,Neotamias Species,Chipmunk Species,Neotamias Species,Neotamias Species,NA,2,0
2002875,SAHE2,77,SA,8/12/2023,6/13/2023,8/28/2023,2023,SA-SAHE2-2023,0,5a06cb57-9553-46f9-ace2-fcfddbcdc753,Mammalia,Rodentia,Sciuridae,Neotamias,NA,Neotamias Species,NA,2023-08-12T14:15:56Z,1,NA,NA,NA,NA,NA,NA,FALSE,NA,NA,CC-BY,NA,Mammal,SA_WI,Neotamias Species,Chipmunk Species,Neotamias Species,Neotamias Species,NA,2,0
2002875,SAHE3,77,SA,8/12/2023,6/13/2023,8/28/2023,2023,SA-SAHE3-2023,0,5a06cb57-9553-46f9-ace2-fcfddbcdc753,Mammalia,Rodentia,Sciuridae,Neotamias,NA,Neotamias Species,NA,2023-08-12T14:15:57Z,1,NA,NA,NA,NA,NA,NA,FALSE,NA,NA,CC-BY,NA,Mammal,SA_WI,Neotamias Species,Chipmunk Species,Neotamias Species,Neotamias Species,NA,2,0
2002875,SAHE1,77,SA,8/12/2023,6/13/2023,8/28/2023,2023,SA-SAHE1-2023,0,5a06cb57-9553-46f9-ace2-fcfddbcdc753,Mammalia,Rodentia,Sciuridae,Neotamias,NA,Neotamias Species,NA,2023-08-12T14:15:58Z,1,NA,NA,NA,NA,NA,NA,FALSE,NA,NA,CC-BY,"{""{\""detectionBox\"":[0.722256482,0.0061417222,0.986007869,0.593736053]}""}",Mammal,SA_WI,Neotamias Species,Chipmunk Species,Neotamias Species,Neotamias Species,NA,2,0
2002875,SAHE2,77,SA,8/12/2023,6/13/2023,8/28/2023,2023,SA-SAHE2-2023,0,5a06cb57-9553-46f9-ace2-fcfddbcdc753,Mammalia,Rodentia,Sciuridae,Neotamias,NA,Neotamias Species,NA,2023-08-12T14:15:58Z,1,NA,NA,NA,NA,NA,NA,FALSE,NA,NA,CC-BY,NA,Mammal,SA_WI,Neotamias Species,Chipmunk Species,Neotamias Species,Neotamias Species,NA,2,0
2002875,SAHE3,77,SA,8/12/2023,6/13/2023,8/28/2023,2023,SA-SAHE3-2023,0,5a06cb57-9553-46f9-ace2-fcfddbcdc753,Mammalia,Rodentia,Sciuridae,Neotamias,NA,Neotamias Species,NA,2023-08-12T14:15:59Z,1,NA,NA,NA,NA,NA,NA,FALSE,NA,NA,CC-BY,NA,Mammal,SA_WI,Neotamias Species,Chipmunk Species,Neotamias Species,Neotamias Species,NA,2,0
2002875,SAHE1,77,SA,8/12/2023,6/13/2023,8/28/2023,2023,SA-SAHE1-2023,0,5a06cb57-9553-46f9-ace2-fcfddbcdc753,Mammalia,Rodentia,Sciuridae,Neotamias,NA,Neotamias Species,NA,2023-08-12T14:16:00Z,1,NA,NA,NA,NA,NA,NA,FALSE,NA,NA,CC-BY,NA,Mammal,SA_WI,Neotamias Species,Chipmunk Species,Neotamias Species,Neotamias Species,NA,2,0
2002875,SAHE2,77,SA,8/12/2023,6/13/2023,8/28/2023,2023,SA-SAHE2-2023,0,5a06cb57-9553-46f9-ace2-fcfddbcdc753,Mammalia,Rodentia,Sciuridae,Neotamias,NA,Neotamias Species,NA,2023-08-12T14:16:01Z,1,NA,NA,NA,NA,NA,NA,FALSE,NA,NA,CC-BY,NA,Mammal,SA_WI,Neotamias Species,Chipmunk Species,Neotamias Species,Neotamias Species,NA,2,0
2002875,SAHE3,77,SA,6/25/2023,6/13/2023,8/28/2023,2023,SA-SAHE3-2023,0,26a96746-25c9-406e-b3a1-1658f81ae0af,Mammalia,Eulipotyphla,Soricidae,NA,NA,Soricidae Family,NA,2023-06-25T05:47:29Z,1,NA,NA,NA,NA,NA,NA,FALSE,NA,NA,CC-BY,NA,Mammal,SA_WI,Soricidae Family,Shrew Family,Soricidae Family,Soricidae Family,NA,2,0
2002875,SAHE1,77,SA,8/13/2023,6/13/2023,8/28/2023,2023,SA-SAHE1-2023,0,26a96746-25c9-406e-b3a1-1658f81ae0af,Mammalia,Eulipotyphla,Soricidae,NA,NA,Soricidae Family,NA,2023-08-13T03:13:28Z,1,NA,NA,NA,NA,NA,NA,FALSE,NA,NA,CC-BY,NA,Mammal,SA_WI,Soricidae Family,Shrew Family,Soricidae Family,Soricidae Family,NA,2,0
2002875,SAHE2,77,SA,8/13/2023,6/13/2023,8/28/2023,2023,SA-SAHE2-2023,0,26a96746-25c9-406e-b3a1-1658f81ae0af,Mammalia,Eulipotyphla,Soricidae,NA,NA,Soricidae Family,NA,2023-08-13T03:13:28Z,1,NA,NA,NA,NA,NA,NA,FALSE,NA,NA,CC-BY,NA,Mammal,SA_WI,Soricidae Family,Shrew Family,Soricidae Family,Soricidae Family,NA,2,0
2002875,SAHE3,77,SA,8/13/2023,6/13/2023,8/28/2023,2023,SA-SAHE3-2023,0,26a96746-25c9-406e-b3a1-1658f81ae0af,Mammalia,Eulipotyphla,Soricidae,NA,NA,Soricidae Family,NA,2023-08-13T03:13:29Z,1,NA,NA,NA,NA,NA,NA,FALSE,NA,NA,CC-BY,NA,Mammal,SA_WI,Soricidae Family,Shrew Family,Soricidae Family,Soricidae Family,NA,2,0
2002875,SAHE1,77,SA,8/13/2023,6/13/2023,8/28/2023,2023,SA-SAHE1-2023,0,26a96746-25c9-406e-b3a1-1658f81ae0af,Mammalia,Eulipotyphla,Soricidae,NA,NA,Soricidae Family,NA,2023-08-13T03:13:37Z,1,NA,NA,NA,NA,NA,NA,FALSE,NA,NA,CC-BY,NA,Mammal,SA_WI,Soricidae Family,Shrew Family,Soricidae Family,Soricidae Family,NA,2,0
2002875,SAHE2,77,SA,6/25/2023,6/13/2023,8/28/2023,2023,SA-SAHE2-2023,0,26a96746-25c9-406e-b3a1-1658f81ae0af,Mammalia,Eulipotyphla,Soricidae,NA,NA,Soricidae Family,NA,2023-06-25T05:47:30Z,1,NA,NA,NA,NA,NA,NA,FALSE,NA,NA,CC-BY,NA,Mammal,SA_WI,Soricidae Family,Shrew Family,Soricidae Family,Soricidae Family,NA,2,0
2002875,SAHE3,77,SA,8/13/2023,6/13/2023,8/28/2023,2023,SA-SAHE3-2023,0,26a96746-25c9-406e-b3a1-1658f81ae0af,Mammalia,Eulipotyphla,Soricidae,NA,NA,Soricidae Family,NA,2023-08-13T03:13:41Z,1,NA,NA,NA,NA,NA,NA,FALSE,NA,NA,CC-BY,NA,Mammal,SA_WI,Soricidae Family,Shrew Family,Soricidae Family,Soricidae Family,NA,2,0
2002875,SAHE1,77,SA,8/13/2023,6/13/2023,8/28/2023,2023,SA-SAHE1-2023,0,26a96746-25c9-406e-b3a1-1658f81ae0af,Mammalia,Eulipotyphla,Soricidae,NA,NA,Soricidae Family,NA,2023-08-13T03:13:41Z,1,NA,NA,NA,NA,NA,NA,FALSE,NA,NA,CC-BY,NA,Mammal,SA_WI,Soricidae Family,Shrew Family,Soricidae Family,Soricidae Family,NA,2,0
2002875,SAHE2,77,SA,8/13/2023,6/13/2023,8/28/2023,2023,SA-SAHE2-2023,0,26a96746-25c9-406e-b3a1-1658f81ae0af,Mammalia,Eulipotyphla,Soricidae,NA,NA,Soricidae Family,NA,2023-08-13T03:13:43Z,1,NA,NA,NA,NA,NA,NA,FALSE,NA,NA,CC-BY,NA,Mammal,SA_WI,Soricidae Family,Shrew Family,Soricidae Family,Soricidae Family,NA,2,0
2002875,SAHE3,77,SA,8/13/2023,6/13/2023,8/28/2023,2023,SA-SAHE3-2023,0,26a96746-25c9-406e-b3a1-1658f81ae0af,Mammalia,Eulipotyphla,Soricidae,NA,NA,Soricidae Family,NA,2023-08-13T03:13:44Z,1,NA,NA,NA,NA,NA,NA,FALSE,NA,NA,CC-BY,"{""{\""detectionBox\"":[0.710401118,0.509103835,0.926390111,0.733216584]}""}",Mammal,SA_WI,Soricidae Family,Shrew Family,Soricidae Family,Soricidae Family,NA,2,0
2002875,SAHE1,77,SA,8/13/2023,6/13/2023,8/28/2023,2023,SA-SAHE1-2023,0,26a96746-25c9-406e-b3a1-1658f81ae0af,Mammalia,Eulipotyphla,Soricidae,NA,NA,Soricidae Family,NA,2023-08-13T03:13:44Z,1,NA,NA,NA,NA,NA,NA,FALSE,NA,NA,CC-BY,NA,Mammal,SA_WI,Soricidae Family,Shrew Family,Soricidae Family,Soricidae Family,NA,2,0
2002875,SAHE2,77,SA,8/13/2023,6/13/2023,8/28/2023,2023,SA-SAHE2-2023,0,5a06cb57-9553-46f9-ace2-fcfddbcdc753,Mammalia,Rodentia,Sciuridae,Neotamias,NA,Neotamias Species,NA,2023-08-13T07:19:10Z,1,NA,NA,NA,NA,NA,NA,FALSE,NA,NA,CC-BY,NA,Mammal,SA_WI,Neotamias Species,Chipmunk Species,Neotamias Species,Neotamias Species,NA,2,0
2002875,SAHE3,77,SA,8/13/2023,6/13/2023,8/28/2023,2023,SA-SAHE3-2023,0,5a06cb57-9553-46f9-ace2-fcfddbcdc753,Mammalia,Rodentia,Sciuridae,Neotamias,NA,Neotamias Species,NA,2023-08-13T08:46:06Z,1,NA,NA,NA,NA,NA,NA,FALSE,NA,NA,CC-BY,NA,Mammal,SA_WI,Neotamias Species,Chipmunk Species,Neotamias Species,Neotamias Species,NA,2,0
2002875,SAHE1,77,SA,8/13/2023,6/13/2023,8/28/2023,2023,SA-SAHE1-2023,0,5a06cb57-9553-46f9-ace2-fcfddbcdc753,Mammalia,Rodentia,Sciuridae,Neotamias,NA,Neotamias Species,NA,2023-08-13T08:46:07Z,1,NA,NA,NA,NA,NA,NA,FALSE,NA,NA,CC-BY,NA,Mammal,SA_WI,Neotamias Species,Chipmunk Species,Neotamias Species,Neotamias Species,NA,2,0
2002875,SAHE2,77,SA,8/13/2023,6/13/2023,8/28/2023,2023,SA-SAHE2-2023,0,5a06cb57-9553-46f9-ace2-fcfddbcdc753,Mammalia,Rodentia,Sciuridae,Neotamias,NA,Neotamias Species,NA,2023-08-13T08:46:12Z,1,NA,NA,NA,NA,NA,NA,FALSE,NA,NA,CC-BY,NA,Mammal,SA_WI,Neotamias Species,Chipmunk Species,Neotamias Species,Neotamias Species,NA,2,0
2002875,SAHE3,77,SA,8/13/2023,6/13/2023,8/28/2023,2023,SA-SAHE3-2023,0,5a06cb57-9553-46f9-ace2-fcfddbcdc753,Mammalia,Rodentia,Sciuridae,Neotamias,NA,Neotamias Species,NA,2023-08-13T08:46:13Z,1,NA,NA,NA,NA,NA,NA,FALSE,NA,NA,CC-BY,NA,Mammal,SA_WI,Neotamias Species,Chipmunk Species,Neotamias Species,Neotamias Species,NA,2,0
2002875,SAHE1,77,SA,8/13/2023,6/13/2023,8/28/2023,2023,SA-SAHE1-2023,0,5a06cb57-9553-46f9-ace2-fcfddbcdc753,Mammalia,Rodentia,Sciuridae,Neotamias,NA,Neotamias Species,NA,2023-08-13T08:46:14Z,1,NA,NA,NA,NA,NA,NA,FALSE,NA,NA,CC-BY,NA,Mammal,SA_WI,Neotamias Species,Chipmunk Species,Neotamias Species,Neotamias Species,NA,2,0
2002875,SAHE2,77,SA,8/13/2023,6/13/2023,8/28/2023,2023,SA-SAHE2-2023,0,5a06cb57-9553-46f9-ace2-fcfddbcdc753,Mammalia,Rodentia,Sciuridae,Neotamias,NA,Neotamias Species,NA,2023-08-13T10:05:34Z,1,NA,NA,NA,NA,NA,NA,FALSE,NA,NA,CC-BY,NA,Mammal,SA_WI,Neotamias Species,Chipmunk Species,Neotamias Species,Neotamias Species,NA,2,0
2002875,SAHE3,77,SA,8/14/2023,6/13/2023,8/28/2023,2023,SA-SAHE3-2023,0,adf63c9e-18c0-451a-a78f-4c29864bc1f5,Mammalia,Rodentia,NA,NA,NA,Mouse species,NA,2023-08-14T00:21:54Z,1,NA,NA,NA,NA,NA,NA,FALSE,NA,NA,CC-BY,"{""{\""detectionBox\"":[0.527876139,0.144850299,0.976475239,0.535537422]}""}",Mammal,SA_WI,Mouse Species,Mouse Species,Mouse Species,Mouse Species,NA,2,0
2002875,SAHE1,77,SA,8/14/2023,6/13/2023,8/28/2023,2023,SA-SAHE1-2023,0,adf63c9e-18c0-451a-a78f-4c29864bc1f5,Mammalia,Rodentia,NA,NA,NA,Mouse species,NA,2023-08-14T00:21:54Z,1,NA,NA,NA,NA,NA,NA,FALSE,NA,NA,CC-BY,NA,Mammal,SA_WI,Mouse Species,Mouse Species,Mouse Species,Mouse Species,NA,2,0
2002875,SAHE2,77,SA,8/14/2023,6/13/2023,8/28/2023,2023,SA-SAHE2-2023,0,adf63c9e-18c0-451a-a78f-4c29864bc1f5,Mammalia,Rodentia,NA,NA,NA,Mouse species,NA,2023-08-14T00:21:55Z,1,NA,NA,NA,NA,NA,NA,FALSE,NA,NA,CC-BY,NA,Mammal,SA_WI,Mouse Species,Mouse Species,Mouse Species,Mouse Species,NA,2,0
2002875,SAHE3,77,SA,8/14/2023,6/13/2023,8/28/2023,2023,SA-SAHE3-2023,0,26a96746-25c9-406e-b3a1-1658f81ae0af,Mammalia,Eulipotyphla,Soricidae,NA,NA,Soricidae Family,NA,2023-08-14T03:36:32Z,1,NA,NA,NA,NA,NA,NA,FALSE,NA,NA,CC-BY,NA,Mammal,SA_WI,Soricidae Family,Shrew Family,Soricidae Family,Soricidae Family,NA,2,0
2002875,SAHE1,77,SA,8/14/2023,6/13/2023,8/28/2023,2023,SA-SAHE1-2023,0,26a96746-25c9-406e-b3a1-1658f81ae0af,Mammalia,Eulipotyphla,Soricidae,NA,NA,Soricidae Family,NA,2023-08-14T03:36:33Z,1,NA,NA,NA,NA,NA,NA,FALSE,NA,NA,CC-BY,NA,Mammal,SA_WI,Soricidae Family,Shrew Family,Soricidae Family,Soricidae Family,NA,2,0
2002875,SAHE2,77,SA,8/14/2023,6/13/2023,8/28/2023,2023,SA-SAHE2-2023,0,26a96746-25c9-406e-b3a1-1658f81ae0af,Mammalia,Eulipotyphla,Soricidae,NA,NA,Soricidae Family,NA,2023-08-14T03:36:37Z,1,NA,NA,NA,NA,NA,NA,FALSE,NA,NA,CC-BY,NA,Mammal,SA_WI,Soricidae Family,Shrew Family,Soricidae Family,Soricidae Family,NA,2,0
2002875,SAHE3,77,SA,8/14/2023,6/13/2023,8/28/2023,2023,SA-SAHE3-2023,0,5a06cb57-9553-46f9-ace2-fcfddbcdc753,Mammalia,Rodentia,Sciuridae,Neotamias,NA,Neotamias Species,NA,2023-08-14T09:32:47Z,1,NA,NA,NA,NA,NA,NA,FALSE,NA,NA,CC-BY,NA,Mammal,SA_WI,Neotamias Species,Chipmunk Species,Neotamias Species,Neotamias Species,NA,2,0
2002875,SAHE1,77,SA,8/14/2023,6/13/2023,8/28/2023,2023,SA-SAHE1-2023,0,5a06cb57-9553-46f9-ace2-fcfddbcdc753,Mammalia,Rodentia,Sciuridae,Neotamias,NA,Neotamias Species,NA,2023-08-14T09:32:47Z,1,NA,NA,NA,NA,NA,NA,FALSE,NA,NA,CC-BY,NA,Mammal,SA_WI,Neotamias Species,Chipmunk Species,Neotamias Species,Neotamias Species,NA,2,0
2002875,SAHE2,77,SA,8/14/2023,6/13/2023,8/28/2023,2023,SA-SAHE2-2023,0,5a06cb57-9553-46f9-ace2-fcfddbcdc753,Mammalia,Rodentia,Sciuridae,Neotamias,NA,Neotamias Species,NA,2023-08-14T09:32:48Z,1,NA,NA,NA,NA,NA,NA,FALSE,NA,NA,CC-BY,NA,Mammal,SA_WI,Neotamias Species,Chipmunk Species,Neotamias Species,Neotamias Species,NA,2,0
2002875,SAHE3,77,SA,6/26/2023,6/13/2023,8/28/2023,2023,SA-SAHE3-2023,0,5a06cb57-9553-46f9-ace2-fcfddbcdc753,Mammalia,Rodentia,Sciuridae,Neotamias,NA,Neotamias Species,NA,2023-06-26T09:23:15Z,1,NA,NA,NA,NA,NA,NA,FALSE,NA,NA,CC-BY,NA,Mammal,SA_WI,Neotamias Species,Chipmunk Species,Neotamias Species,Neotamias Species,NA,2,0
2002875,SAHE1,77,SA,8/14/2023,6/13/2023,8/28/2023,2023,SA-SAHE1-2023,0,5a06cb57-9553-46f9-ace2-fcfddbcdc753,Mammalia,Rodentia,Sciuridae,Neotamias,NA,Neotamias Species,NA,2023-08-14T09:32:49Z,1,NA,NA,NA,NA,NA,NA,FALSE,NA,NA,CC-BY,"{""{\""detectionBox\"":[0.530617952,0.0565277636,0.969585538,0.495679408]}""}",Mammal,SA_WI,Neotamias Species,Chipmunk Species,Neotamias Species,Neotamias Species,NA,2,0
2002875,SAHE2,77,SA,8/14/2023,6/13/2023,8/28/2023,2023,SA-SAHE2-2023,0,5a06cb57-9553-46f9-ace2-fcfddbcdc753,Mammalia,Rodentia,Sciuridae,Neotamias,NA,Neotamias Species,NA,2023-08-14T09:32:49Z,1,NA,NA,NA,NA,NA,NA,FALSE,NA,NA,CC-BY,NA,Mammal,SA_WI,Neotamias Species,Chipmunk Species,Neotamias Species,Neotamias Species,NA,2,0
2002875,SAHE3,77,SA,8/14/2023,6/13/2023,8/28/2023,2023,SA-SAHE3-2023,0,5a06cb57-9553-46f9-ace2-fcfddbcdc753,Mammalia,Rodentia,Sciuridae,Neotamias,NA,Neotamias Species,NA,2023-08-14T09:32:50Z,1,NA,NA,NA,NA,NA,NA,FALSE,NA,NA,CC-BY,NA,Mammal,SA_WI,Neotamias Species,Chipmunk Species,Neotamias Species,Neotamias Species,NA,2,0
2002875,SAHE1,77,SA,6/26/2023,6/13/2023,8/28/2023,2023,SA-SAHE1-2023,0,5a06cb57-9553-46f9-ace2-fcfddbcdc753,Mammalia,Rodentia,Sciuridae,Neotamias,NA,Neotamias Species,NA,2023-06-26T09:23:17Z,1,NA,NA,NA,NA,NA,NA,FALSE,NA,NA,CC-BY,NA,Mammal,SA_WI,Neotamias Species,Chipmunk Species,Neotamias Species,Neotamias Species,NA,2,0
2002875,SAHE2,77,SA,8/14/2023,6/13/2023,8/28/2023,2023,SA-SAHE2-2023,0,5a06cb57-9553-46f9-ace2-fcfddbcdc753,Mammalia,Rodentia,Sciuridae,Neotamias,NA,Neotamias Species,NA,2023-08-14T13:43:08Z,1,NA,NA,NA,NA,NA,NA,FALSE,NA,NA,CC-BY,NA,Mammal,SA_WI,Neotamias Species,Chipmunk Species,Neotamias Species,Neotamias Species,NA,2,0
2002875,SAHE3,77,SA,8/14/2023,6/13/2023,8/28/2023,2023,SA-SAHE3-2023,0,5a06cb57-9553-46f9-ace2-fcfddbcdc753,Mammalia,Rodentia,Sciuridae,Neotamias,NA,Neotamias Species,NA,2023-08-14T13:43:07Z,1,NA,NA,NA,NA,NA,NA,FALSE,NA,NA,CC-BY,NA,Mammal,SA_WI,Neotamias Species,Chipmunk Species,Neotamias Species,Neotamias Species,NA,2,0
2002875,SAHE1,77,SA,8/14/2023,6/13/2023,8/28/2023,2023,SA-SAHE1-2023,0,5a06cb57-9553-46f9-ace2-fcfddbcdc753,Mammalia,Rodentia,Sciuridae,Neotamias,NA,Neotamias Species,NA,2023-08-14T13:43:08Z,1,NA,NA,NA,NA,NA,NA,FALSE,NA,NA,CC-BY,NA,Mammal,SA_WI,Neotamias Species,Chipmunk Species,Neotamias Species,Neotamias Species,NA,2,0
2002875,SAHE2,77,SA,8/14/2023,6/13/2023,8/28/2023,2023,SA-SAHE2-2023,0,5a06cb57-9553-46f9-ace2-fcfddbcdc753,Mammalia,Rodentia,Sciuridae,Neotamias,NA,Neotamias Species,NA,2023-08-14T13:43:10Z,1,NA,NA,NA,NA,NA,NA,FALSE,NA,NA,CC-BY,NA,Mammal,SA_WI,Neotamias Species,Chipmunk Species,Neotamias Species,Neotamias Species,NA,2,0
2002875,SAHE3,77,SA,6/26/2023,6/13/2023,8/28/2023,2023,SA-SAHE3-2023,0,5a06cb57-9553-46f9-ace2-fcfddbcdc753,Mammalia,Rodentia,Sciuridae,Neotamias,NA,Neotamias Species,NA,2023-06-26T09:23:17Z,1,NA,NA,NA,NA,NA,NA,FALSE,NA,NA,CC-BY,NA,Mammal,SA_WI,Neotamias Species,Chipmunk Species,Neotamias Species,Neotamias Species,NA,2,0
2002875,SAHE1,77,SA,8/15/2023,6/13/2023,8/28/2023,2023,SA-SAHE1-2023,0,26a96746-25c9-406e-b3a1-1658f81ae0af,Mammalia,Eulipotyphla,Soricidae,NA,NA,Soricidae Family,NA,2023-08-15T01:21:30Z,1,NA,NA,NA,NA,NA,NA,FALSE,NA,NA,CC-BY,NA,Mammal,SA_WI,Soricidae Family,Shrew Family,Soricidae Family,Soricidae Family,NA,2,0
2002875,SAHE2,77,SA,8/15/2023,6/13/2023,8/28/2023,2023,SA-SAHE2-2023,0,26a96746-25c9-406e-b3a1-1658f81ae0af,Mammalia,Eulipotyphla,Soricidae,NA,NA,Soricidae Family,NA,2023-08-15T01:21:31Z,1,NA,NA,NA,NA,NA,NA,FALSE,NA,NA,CC-BY,NA,Mammal,SA_WI,Soricidae Family,Shrew Family,Soricidae Family,Soricidae Family,NA,2,0
2002875,SAHE3,77,SA,8/15/2023,6/13/2023,8/28/2023,2023,SA-SAHE3-2023,0,26a96746-25c9-406e-b3a1-1658f81ae0af,Mammalia,Eulipotyphla,Soricidae,NA,NA,Soricidae Family,NA,2023-08-15T01:21:32Z,1,NA,NA,NA,NA,NA,NA,FALSE,NA,NA,CC-BY,NA,Mammal,SA_WI,Soricidae Family,Shrew Family,Soricidae Family,Soricidae Family,NA,2,0
2002875,SAHE1,77,SA,8/15/2023,6/13/2023,8/28/2023,2023,SA-SAHE1-2023,0,26a96746-25c9-406e-b3a1-1658f81ae0af,Mammalia,Eulipotyphla,Soricidae,NA,NA,Soricidae Family,NA,2023-08-15T01:21:33Z,1,NA,NA,NA,NA,NA,NA,FALSE,NA,NA,CC-BY,NA,Mammal,SA_WI,Soricidae Family,Shrew Family,Soricidae Family,Soricidae Family,NA,2,0
2002875,SAHE2,77,SA,8/15/2023,6/13/2023,8/28/2023,2023,SA-SAHE2-2023,0,26a96746-25c9-406e-b3a1-1658f81ae0af,Mammalia,Eulipotyphla,Soricidae,NA,NA,Soricidae Family,NA,2023-08-15T01:21:34Z,1,NA,NA,NA,NA,NA,NA,FALSE,NA,NA,CC-BY,NA,Mammal,SA_WI,Soricidae Family,Shrew Family,Soricidae Family,Soricidae Family,NA,2,0
2002875,SAHE3,77,SA,8/15/2023,6/13/2023,8/28/2023,2023,SA-SAHE3-2023,0,26a96746-25c9-406e-b3a1-1658f81ae0af,Mammalia,Eulipotyphla,Soricidae,NA,NA,Soricidae Family,NA,2023-08-15T01:21:34Z,1,NA,NA,NA,NA,NA,NA,FALSE,NA,NA,CC-BY,NA,Mammal,SA_WI,Soricidae Family,Shrew Family,Soricidae Family,Soricidae Family,NA,2,0
2002875,SAHE1,77,SA,6/26/2023,6/13/2023,8/28/2023,2023,SA-SAHE1-2023,0,5a06cb57-9553-46f9-ace2-fcfddbcdc753,Mammalia,Rodentia,Sciuridae,Neotamias,NA,Neotamias Species,NA,2023-06-26T09:23:20Z,1,NA,NA,NA,NA,NA,NA,FALSE,NA,NA,CC-BY,"{""{\""detectionBox\"":[0.495055228,0.277089179,0.974628329,0.799988568]}""}",Mammal,SA_WI,Neotamias Species,Chipmunk Species,Neotamias Species,Neotamias Species,NA,2,0
2002875,SAHE2,77,SA,8/15/2023,6/13/2023,8/28/2023,2023,SA-SAHE2-2023,0,26a96746-25c9-406e-b3a1-1658f81ae0af,Mammalia,Eulipotyphla,Soricidae,NA,NA,Soricidae Family,NA,2023-08-15T01:21:35Z,1,NA,NA,NA,NA,NA,NA,FALSE,NA,NA,CC-BY,NA,Mammal,SA_WI,Soricidae Family,Shrew Family,Soricidae Family,Soricidae Family,NA,2,0
2002875,SAHE3,77,SA,8/15/2023,6/13/2023,8/28/2023,2023,SA-SAHE3-2023,0,26a96746-25c9-406e-b3a1-1658f81ae0af,Mammalia,Eulipotyphla,Soricidae,NA,NA,Soricidae Family,NA,2023-08-15T01:21:36Z,1,NA,NA,NA,NA,NA,NA,FALSE,NA,NA,CC-BY,NA,Mammal,SA_WI,Soricidae Family,Shrew Family,Soricidae Family,Soricidae Family,NA,2,0
2002875,SAHE1,77,SA,6/26/2023,6/13/2023,8/28/2023,2023,SA-SAHE1-2023,0,5a06cb57-9553-46f9-ace2-fcfddbcdc753,Mammalia,Rodentia,Sciuridae,Neotamias,NA,Neotamias Species,NA,2023-06-26T09:23:21Z,1,NA,NA,NA,NA,NA,NA,FALSE,NA,NA,CC-BY,"{""{\""detectionBox\"":[0.486514419,0.281346262,0.971739411,0.767451346]}""}",Mammal,SA_WI,Neotamias Species,Chipmunk Species,Neotamias Species,Neotamias Species,NA,2,0
2002875,SAHE2,77,SA,6/26/2023,6/13/2023,8/28/2023,2023,SA-SAHE2-2023,0,5a06cb57-9553-46f9-ace2-fcfddbcdc753,Mammalia,Rodentia,Sciuridae,Neotamias,NA,Neotamias Species,NA,2023-06-26T09:23:21Z,1,NA,NA,NA,NA,NA,NA,FALSE,NA,NA,CC-BY,"{""{\""detectionBox\"":[0.438624412,0.286826134,0.969592333,0.773641467]}""}",Mammal,SA_WI,Neotamias Species,Chipmunk Species,Neotamias Species,Neotamias Species,NA,2,0
2002875,SAHE3,77,SA,6/26/2023,6/13/2023,8/28/2023,2023,SA-SAHE3-2023,0,5a06cb57-9553-46f9-ace2-fcfddbcdc753,Mammalia,Rodentia,Sciuridae,Neotamias,NA,Neotamias Species,NA,2023-06-26T09:23:23Z,1,NA,NA,NA,NA,NA,NA,FALSE,NA,NA,CC-BY,"{""{\""detectionBox\"":[0.461402982,0.288013637,0.971845806,0.755618036]}""}",Mammal,SA_WI,Neotamias Species,Chipmunk Species,Neotamias Species,Neotamias Species,NA,2,0
2002875,SAHE1,77,SA,6/26/2023,6/13/2023,8/28/2023,2023,SA-SAHE1-2023,0,5a06cb57-9553-46f9-ace2-fcfddbcdc753,Mammalia,Rodentia,Sciuridae,Neotamias,NA,Neotamias Species,NA,2023-06-26T09:23:23Z,1,NA,NA,NA,NA,NA,NA,FALSE,NA,NA,CC-BY,"{""{\""detectionBox\"":[0.471468717,0.266925871,0.970578253,0.760561049]}""}",Mammal,SA_WI,Neotamias Species,Chipmunk Species,Neotamias Species,Neotamias Species,NA,2,0
2002875,SAHE2,77,SA,8/15/2023,6/13/2023,8/28/2023,2023,SA-SAHE2-2023,0,5a06cb57-9553-46f9-ace2-fcfddbcdc753,Mammalia,Rodentia,Sciuridae,Neotamias,NA,Neotamias Species,NA,2023-08-15T08:30:52Z,1,NA,NA,NA,NA,NA,NA,FALSE,NA,NA,CC-BY,NA,Mammal,SA_WI,Neotamias Species,Chipmunk Species,Neotamias Species,Neotamias Species,NA,2,0
2002875,SAHE3,77,SA,6/26/2023,6/13/2023,8/28/2023,2023,SA-SAHE3-2023,0,5a06cb57-9553-46f9-ace2-fcfddbcdc753,Mammalia,Rodentia,Sciuridae,Neotamias,NA,Neotamias Species,NA,2023-06-26T09:23:24Z,1,NA,NA,NA,NA,NA,NA,FALSE,NA,NA,CC-BY,"{""{\""detectionBox\"":[0.43772456,0.275738776,0.968935728,0.751755178]}""}",Mammal,SA_WI,Neotamias Species,Chipmunk Species,Neotamias Species,Neotamias Species,NA,2,0
2002875,SAHE1,77,SA,8/15/2023,6/13/2023,8/28/2023,2023,SA-SAHE1-2023,0,d01f67fd-836b-4b25-89fc-2239e59f56b0,Mammalia,Rodentia,Sciuridae,Otospermophilus,beecheyi,California Ground Squirrel,NA,2023-08-15T10:55:19Z,1,NA,NA,NA,NA,NA,NA,FALSE,NA,NA,CC-BY,NA,Mammal,SA_WI,California Ground Squirrel,California ground squirrel,California Ground Squirrel,California Ground Squirrel,Otospermophilus beecheyi,2,0
2002875,SAHE2,77,SA,8/15/2023,6/13/2023,8/28/2023,2023,SA-SAHE2-2023,0,d01f67fd-836b-4b25-89fc-2239e59f56b0,Mammalia,Rodentia,Sciuridae,Otospermophilus,beecheyi,California Ground Squirrel,NA,2023-08-15T10:55:21Z,1,NA,NA,NA,NA,NA,NA,FALSE,NA,NA,CC-BY,"{""{\""detectionBox\"":[0.583297431,0.242887765,0.978244066,0.725572348]}""}",Mammal,SA_WI,California Ground Squirrel,California ground squirrel,California Ground Squirrel,California Ground Squirrel,Otospermophilus beecheyi,2,0
2002875,SAHE3,77,SA,8/15/2023,6/13/2023,8/28/2023,2023,SA-SAHE3-2023,0,d01f67fd-836b-4b25-89fc-2239e59f56b0,Mammalia,Rodentia,Sciuridae,Otospermophilus,beecheyi,California Ground Squirrel,NA,2023-08-15T10:55:21Z,1,NA,NA,NA,NA,NA,NA,FALSE,NA,NA,CC-BY,NA,Mammal,SA_WI,California Ground Squirrel,California ground squirrel,California Ground Squirrel,California Ground Squirrel,Otospermophilus beecheyi,2,0
2002875,SAHE1,77,SA,8/15/2023,6/13/2023,8/28/2023,2023,SA-SAHE1-2023,0,d01f67fd-836b-4b25-89fc-2239e59f56b0,Mammalia,Rodentia,Sciuridae,Otospermophilus,beecheyi,California Ground Squirrel,NA,2023-08-15T10:55:22Z,1,NA,NA,NA,NA,NA,NA,FALSE,NA,NA,CC-BY,"{""{\""detectionBox\"":[0.127169341,0.303083569,0.98363173,0.570874453]}""}",Mammal,SA_WI,California Ground Squirrel,California ground squirrel,California Ground Squirrel,California Ground Squirrel,Otospermophilus beecheyi,2,0
2002875,SAHE2,77,SA,8/15/2023,6/13/2023,8/28/2023,2023,SA-SAHE2-2023,0,d01f67fd-836b-4b25-89fc-2239e59f56b0,Mammalia,Rodentia,Sciuridae,Otospermophilus,beecheyi,California Ground Squirrel,NA,2023-08-15T10:55:23Z,1,NA,NA,NA,NA,NA,NA,FALSE,NA,NA,CC-BY,NA,Mammal,SA_WI,California Ground Squirrel,California ground squirrel,California Ground Squirrel,California Ground Squirrel,Otospermophilus beecheyi,2,0
2002875,SAHE3,77,SA,8/15/2023,6/13/2023,8/28/2023,2023,SA-SAHE3-2023,0,d01f67fd-836b-4b25-89fc-2239e59f56b0,Mammalia,Rodentia,Sciuridae,Otospermophilus,beecheyi,California Ground Squirrel,NA,2023-08-15T10:55:24Z,1,NA,NA,NA,NA,NA,NA,FALSE,NA,NA,CC-BY,NA,Mammal,SA_WI,California Ground Squirrel,California ground squirrel,California Ground Squirrel,California Ground Squirrel,Otospermophilus beecheyi,2,0
2002875,SAHE1,77,SA,8/15/2023,6/13/2023,8/28/2023,2023,SA-SAHE1-2023,0,d01f67fd-836b-4b25-89fc-2239e59f56b0,Mammalia,Rodentia,Sciuridae,Otospermophilus,beecheyi,California Ground Squirrel,NA,2023-08-15T10:55:24Z,1,NA,NA,NA,NA,NA,NA,FALSE,NA,NA,CC-BY,NA,Mammal,SA_WI,California Ground Squirrel,California ground squirrel,California Ground Squirrel,California Ground Squirrel,Otospermophilus beecheyi,2,0
2002875,SAHE2,77,SA,6/26/2023,6/13/2023,8/28/2023,2023,SA-SAHE2-2023,0,5a06cb57-9553-46f9-ace2-fcfddbcdc753,Mammalia,Rodentia,Sciuridae,Neotamias,NA,Neotamias Species,NA,2023-06-26T09:23:26Z,1,NA,NA,NA,NA,NA,NA,FALSE,NA,NA,CC-BY,"{""{\""detectionBox\"":[0.476846397,0.308352888,0.968976259,0.794283807]}""}",Mammal,SA_WI,Neotamias Species,Chipmunk Species,Neotamias Species,Neotamias Species,NA,2,0
2002875,SAHE3,77,SA,8/15/2023,6/13/2023,8/28/2023,2023,SA-SAHE3-2023,0,d01f67fd-836b-4b25-89fc-2239e59f56b0,Mammalia,Rodentia,Sciuridae,Otospermophilus,beecheyi,California Ground Squirrel,NA,2023-08-15T13:48:52Z,1,NA,NA,NA,NA,NA,NA,FALSE,NA,NA,CC-BY,NA,Mammal,SA_WI,California Ground Squirrel,California ground squirrel,California Ground Squirrel,California Ground Squirrel,Otospermophilus beecheyi,2,0
2002875,SAHE1,77,SA,8/15/2023,6/13/2023,8/28/2023,2023,SA-SAHE1-2023,0,d01f67fd-836b-4b25-89fc-2239e59f56b0,Mammalia,Rodentia,Sciuridae,Otospermophilus,beecheyi,California Ground Squirrel,NA,2023-08-15T13:48:52Z,1,NA,NA,NA,NA,NA,NA,FALSE,NA,NA,CC-BY,NA,Mammal,SA_WI,California Ground Squirrel,California ground squirrel,California Ground Squirrel,California Ground Squirrel,Otospermophilus beecheyi,2,0
2002875,SAHE2,77,SA,8/15/2023,6/13/2023,8/28/2023,2023,SA-SAHE2-2023,0,d01f67fd-836b-4b25-89fc-2239e59f56b0,Mammalia,Rodentia,Sciuridae,Otospermophilus,beecheyi,California Ground Squirrel,NA,2023-08-15T13:48:53Z,1,NA,NA,NA,NA,NA,NA,FALSE,NA,NA,CC-BY,NA,Mammal,SA_WI,California Ground Squirrel,California ground squirrel,California Ground Squirrel,California Ground Squirrel,Otospermophilus beecheyi,2,0
2002875,SAHE3,77,SA,8/15/2023,6/13/2023,8/28/2023,2023,SA-SAHE3-2023,0,d01f67fd-836b-4b25-89fc-2239e59f56b0,Mammalia,Rodentia,Sciuridae,Otospermophilus,beecheyi,California Ground Squirrel,NA,2023-08-15T13:48:54Z,1,NA,NA,NA,NA,NA,NA,FALSE,NA,NA,CC-BY,NA,Mammal,SA_WI,California Ground Squirrel,California ground squirrel,California Ground Squirrel,California Ground Squirrel,Otospermophilus beecheyi,2,0
2002875,SAHE1,77,SA,8/15/2023,6/13/2023,8/28/2023,2023,SA-SAHE1-2023,0,d01f67fd-836b-4b25-89fc-2239e59f56b0,Mammalia,Rodentia,Sciuridae,Otospermophilus,beecheyi,California Ground Squirrel,NA,2023-08-15T13:48:55Z,1,NA,NA,NA,NA,NA,NA,FALSE,NA,NA,CC-BY,NA,Mammal,SA_WI,California Ground Squirrel,California ground squirrel,California Ground Squirrel,California Ground Squirrel,Otospermophilus beecheyi,2,0
2002875,SAHE2,77,SA,8/15/2023,6/13/2023,8/28/2023,2023,SA-SAHE2-2023,0,d01f67fd-836b-4b25-89fc-2239e59f56b0,Mammalia,Rodentia,Sciuridae,Otospermophilus,beecheyi,California Ground Squirrel,NA,2023-08-15T13:48:56Z,1,NA,NA,NA,NA,NA,NA,FALSE,NA,NA,CC-BY,NA,Mammal,SA_WI,California Ground Squirrel,California ground squirrel,California Ground Squirrel,California Ground Squirrel,Otospermophilus beecheyi,2,0
2002875,SAHE3,77,SA,8/15/2023,6/13/2023,8/28/2023,2023,SA-SAHE3-2023,0,d01f67fd-836b-4b25-89fc-2239e59f56b0,Mammalia,Rodentia,Sciuridae,Otospermophilus,beecheyi,California Ground Squirrel,NA,2023-08-15T13:48:57Z,1,NA,NA,NA,NA,NA,NA,FALSE,NA,NA,CC-BY,NA,Mammal,SA_WI,California Ground Squirrel,California ground squirrel,California Ground Squirrel,California Ground Squirrel,Otospermophilus beecheyi,2,0
2002875,SAHE1,77,SA,8/15/2023,6/13/2023,8/28/2023,2023,SA-SAHE1-2023,0,d01f67fd-836b-4b25-89fc-2239e59f56b0,Mammalia,Rodentia,Sciuridae,Otospermophilus,beecheyi,California Ground Squirrel,NA,2023-08-15T13:48:58Z,1,NA,NA,NA,NA,NA,NA,FALSE,NA,NA,CC-BY,NA,Mammal,SA_WI,California Ground Squirrel,California ground squirrel,California Ground Squirrel,California Ground Squirrel,Otospermophilus beecheyi,2,0
2002875,SAHE2,77,SA,8/15/2023,6/13/2023,8/28/2023,2023,SA-SAHE2-2023,0,d01f67fd-836b-4b25-89fc-2239e59f56b0,Mammalia,Rodentia,Sciuridae,Otospermophilus,beecheyi,California Ground Squirrel,NA,2023-08-15T13:48:58Z,1,NA,NA,NA,NA,NA,NA,FALSE,NA,NA,CC-BY,NA,Mammal,SA_WI,California Ground Squirrel,California ground squirrel,California Ground Squirrel,California Ground Squirrel,Otospermophilus beecheyi,2,0
2002875,SAHE3,77,SA,8/15/2023,6/13/2023,8/28/2023,2023,SA-SAHE3-2023,0,d01f67fd-836b-4b25-89fc-2239e59f56b0,Mammalia,Rodentia,Sciuridae,Otospermophilus,beecheyi,California Ground Squirrel,NA,2023-08-15T13:49:01Z,1,NA,NA,NA,NA,NA,NA,FALSE,NA,NA,CC-BY,NA,Mammal,SA_WI,California Ground Squirrel,California ground squirrel,California Ground Squirrel,California Ground Squirrel,Otospermophilus beecheyi,2,0
2002875,SAHE1,77,SA,6/26/2023,6/13/2023,8/28/2023,2023,SA-SAHE1-2023,0,5a06cb57-9553-46f9-ace2-fcfddbcdc753,Mammalia,Rodentia,Sciuridae,Neotamias,NA,Neotamias Species,NA,2023-06-26T09:23:26Z,1,NA,NA,NA,NA,NA,NA,FALSE,NA,NA,CC-BY,NA,Mammal,SA_WI,Neotamias Species,Chipmunk Species,Neotamias Species,Neotamias Species,NA,2,0
2002875,SAHE2,77,SA,8/15/2023,6/13/2023,8/28/2023,2023,SA-SAHE2-2023,0,d01f67fd-836b-4b25-89fc-2239e59f56b0,Mammalia,Rodentia,Sciuridae,Otospermophilus,beecheyi,California Ground Squirrel,NA,2023-08-15T13:49:01Z,1,NA,NA,NA,NA,NA,NA,FALSE,NA,NA,CC-BY,NA,Mammal,SA_WI,California Ground Squirrel,California ground squirrel,California Ground Squirrel,California Ground Squirrel,Otospermophilus beecheyi,2,0
2002875,SAHE3,77,SA,8/15/2023,6/13/2023,8/28/2023,2023,SA-SAHE3-2023,0,d01f67fd-836b-4b25-89fc-2239e59f56b0,Mammalia,Rodentia,Sciuridae,Otospermophilus,beecheyi,California Ground Squirrel,NA,2023-08-15T13:49:02Z,1,NA,NA,NA,NA,NA,NA,FALSE,NA,NA,CC-BY,NA,Mammal,SA_WI,California Ground Squirrel,California ground squirrel,California Ground Squirrel,California Ground Squirrel,Otospermophilus beecheyi,2,0
2002875,SAHE1,77,SA,8/15/2023,6/13/2023,8/28/2023,2023,SA-SAHE1-2023,0,d01f67fd-836b-4b25-89fc-2239e59f56b0,Mammalia,Rodentia,Sciuridae,Otospermophilus,beecheyi,California Ground Squirrel,NA,2023-08-15T13:49:03Z,1,NA,NA,NA,NA,NA,NA,FALSE,NA,NA,CC-BY,NA,Mammal,SA_WI,California Ground Squirrel,California ground squirrel,California Ground Squirrel,California Ground Squirrel,Otospermophilus beecheyi,2,0
2002875,SAHE2,77,SA,8/15/2023,6/13/2023,8/28/2023,2023,SA-SAHE2-2023,0,d01f67fd-836b-4b25-89fc-2239e59f56b0,Mammalia,Rodentia,Sciuridae,Otospermophilus,beecheyi,California Ground Squirrel,NA,2023-08-15T13:49:04Z,1,NA,NA,NA,NA,NA,NA,FALSE,NA,NA,CC-BY,NA,Mammal,SA_WI,California Ground Squirrel,California ground squirrel,California Ground Squirrel,California Ground Squirrel,Otospermophilus beecheyi,2,0
2002875,SAHE3,77,SA,8/15/2023,6/13/2023,8/28/2023,2023,SA-SAHE3-2023,0,d01f67fd-836b-4b25-89fc-2239e59f56b0,Mammalia,Rodentia,Sciuridae,Otospermophilus,beecheyi,California Ground Squirrel,NA,2023-08-15T13:49:04Z,1,NA,NA,NA,NA,NA,NA,FALSE,NA,NA,CC-BY,NA,Mammal,SA_WI,California Ground Squirrel,California ground squirrel,California Ground Squirrel,California Ground Squirrel,Otospermophilus beecheyi,2,0
2002875,SAHE1,77,SA,8/15/2023,6/13/2023,8/28/2023,2023,SA-SAHE1-2023,0,d01f67fd-836b-4b25-89fc-2239e59f56b0,Mammalia,Rodentia,Sciuridae,Otospermophilus,beecheyi,California Ground Squirrel,NA,2023-08-15T13:49:06Z,1,NA,NA,NA,NA,NA,NA,FALSE,NA,NA,CC-BY,NA,Mammal,SA_WI,California Ground Squirrel,California ground squirrel,California Ground Squirrel,California Ground Squirrel,Otospermophilus beecheyi,2,0
2002875,SAHE2,77,SA,8/15/2023,6/13/2023,8/28/2023,2023,SA-SAHE2-2023,0,d01f67fd-836b-4b25-89fc-2239e59f56b0,Mammalia,Rodentia,Sciuridae,Otospermophilus,beecheyi,California Ground Squirrel,NA,2023-08-15T13:49:07Z,1,NA,NA,NA,NA,NA,NA,FALSE,NA,NA,CC-BY,NA,Mammal,SA_WI,California Ground Squirrel,California ground squirrel,California Ground Squirrel,California Ground Squirrel,Otospermophilus beecheyi,2,0
2002875,SAHE3,77,SA,8/15/2023,6/13/2023,8/28/2023,2023,SA-SAHE3-2023,0,d01f67fd-836b-4b25-89fc-2239e59f56b0,Mammalia,Rodentia,Sciuridae,Otospermophilus,beecheyi,California Ground Squirrel,NA,2023-08-15T13:49:07Z,1,NA,NA,NA,NA,NA,NA,FALSE,NA,NA,CC-BY,NA,Mammal,SA_WI,California Ground Squirrel,California ground squirrel,California Ground Squirrel,California Ground Squirrel,Otospermophilus beecheyi,2,0
2002875,SAHE1,77,SA,8/15/2023,6/13/2023,8/28/2023,2023,SA-SAHE1-2023,0,d01f67fd-836b-4b25-89fc-2239e59f56b0,Mammalia,Rodentia,Sciuridae,Otospermophilus,beecheyi,California Ground Squirrel,NA,2023-08-15T13:49:17Z,1,NA,NA,NA,NA,NA,NA,FALSE,NA,NA,CC-BY,NA,Mammal,SA_WI,California Ground Squirrel,California ground squirrel,California Ground Squirrel,California Ground Squirrel,Otospermophilus beecheyi,2,0
2002875,SAHE2,77,SA,6/26/2023,6/13/2023,8/28/2023,2023,SA-SAHE2-2023,0,5a06cb57-9553-46f9-ace2-fcfddbcdc753,Mammalia,Rodentia,Sciuridae,Neotamias,NA,Neotamias Species,NA,2023-06-26T09:23:27Z,1,NA,NA,NA,NA,NA,NA,FALSE,NA,NA,CC-BY,NA,Mammal,SA_WI,Neotamias Species,Chipmunk Species,Neotamias Species,Neotamias Species,NA,2,0
2002875,SAHE3,77,SA,8/15/2023,6/13/2023,8/28/2023,2023,SA-SAHE3-2023,0,d01f67fd-836b-4b25-89fc-2239e59f56b0,Mammalia,Rodentia,Sciuridae,Otospermophilus,beecheyi,California Ground Squirrel,NA,2023-08-15T13:49:18Z,1,NA,NA,NA,NA,NA,NA,FALSE,NA,NA,CC-BY,NA,Mammal,SA_WI,California Ground Squirrel,California ground squirrel,California Ground Squirrel,California Ground Squirrel,Otospermophilus beecheyi,2,0
2002875,SAHE1,77,SA,8/15/2023,6/13/2023,8/28/2023,2023,SA-SAHE1-2023,0,d01f67fd-836b-4b25-89fc-2239e59f56b0,Mammalia,Rodentia,Sciuridae,Otospermophilus,beecheyi,California Ground Squirrel,NA,2023-08-15T13:49:19Z,1,NA,NA,NA,NA,NA,NA,FALSE,NA,NA,CC-BY,NA,Mammal,SA_WI,California Ground Squirrel,California ground squirrel,California Ground Squirrel,California Ground Squirrel,Otospermophilus beecheyi,2,0
2002875,SAHE2,77,SA,8/15/2023,6/13/2023,8/28/2023,2023,SA-SAHE2-2023,0,d01f67fd-836b-4b25-89fc-2239e59f56b0,Mammalia,Rodentia,Sciuridae,Otospermophilus,beecheyi,California Ground Squirrel,NA,2023-08-15T13:49:19Z,1,NA,NA,NA,NA,NA,NA,FALSE,NA,NA,CC-BY,NA,Mammal,SA_WI,California Ground Squirrel,California ground squirrel,California Ground Squirrel,California Ground Squirrel,Otospermophilus beecheyi,2,0
2002875,SAHE3,77,SA,8/15/2023,6/13/2023,8/28/2023,2023,SA-SAHE3-2023,0,d01f67fd-836b-4b25-89fc-2239e59f56b0,Mammalia,Rodentia,Sciuridae,Otospermophilus,beecheyi,California Ground Squirrel,NA,2023-08-15T13:49:20Z,1,NA,NA,NA,NA,NA,NA,FALSE,NA,NA,CC-BY,NA,Mammal,SA_WI,California Ground Squirrel,California ground squirrel,California Ground Squirrel,California Ground Squirrel,Otospermophilus beecheyi,2,0
2002875,SAHE1,77,SA,8/15/2023,6/13/2023,8/28/2023,2023,SA-SAHE1-2023,0,d01f67fd-836b-4b25-89fc-2239e59f56b0,Mammalia,Rodentia,Sciuridae,Otospermophilus,beecheyi,California Ground Squirrel,NA,2023-08-15T13:49:22Z,1,NA,NA,NA,NA,NA,NA,FALSE,NA,NA,CC-BY,NA,Mammal,SA_WI,California Ground Squirrel,California ground squirrel,California Ground Squirrel,California Ground Squirrel,Otospermophilus beecheyi,2,0
2002875,SAHE2,77,SA,8/15/2023,6/13/2023,8/28/2023,2023,SA-SAHE2-2023,0,d01f67fd-836b-4b25-89fc-2239e59f56b0,Mammalia,Rodentia,Sciuridae,Otospermophilus,beecheyi,California Ground Squirrel,NA,2023-08-15T13:49:22Z,1,NA,NA,NA,NA,NA,NA,FALSE,NA,NA,CC-BY,NA,Mammal,SA_WI,California Ground Squirrel,California ground squirrel,California Ground Squirrel,California Ground Squirrel,Otospermophilus beecheyi,2,0
2002875,SAHE3,77,SA,8/15/2023,6/13/2023,8/28/2023,2023,SA-SAHE3-2023,0,d01f67fd-836b-4b25-89fc-2239e59f56b0,Mammalia,Rodentia,Sciuridae,Otospermophilus,beecheyi,California Ground Squirrel,NA,2023-08-15T13:49:23Z,1,NA,NA,NA,NA,NA,NA,FALSE,NA,NA,CC-BY,NA,Mammal,SA_WI,California Ground Squirrel,California ground squirrel,California Ground Squirrel,California Ground Squirrel,Otospermophilus beecheyi,2,0
2002875,SAHE1,77,SA,8/15/2023,6/13/2023,8/28/2023,2023,SA-SAHE1-2023,0,d01f67fd-836b-4b25-89fc-2239e59f56b0,Mammalia,Rodentia,Sciuridae,Otospermophilus,beecheyi,California Ground Squirrel,NA,2023-08-15T13:49:24Z,1,NA,NA,NA,NA,NA,NA,FALSE,NA,NA,CC-BY,NA,Mammal,SA_WI,California Ground Squirrel,California ground squirrel,California Ground Squirrel,California Ground Squirrel,Otospermophilus beecheyi,2,0
2002875,SAHE2,77,SA,8/15/2023,6/13/2023,8/28/2023,2023,SA-SAHE2-2023,0,d01f67fd-836b-4b25-89fc-2239e59f56b0,Mammalia,Rodentia,Sciuridae,Otospermophilus,beecheyi,California Ground Squirrel,NA,2023-08-15T13:49:24Z,1,NA,NA,NA,NA,NA,NA,FALSE,NA,NA,CC-BY,NA,Mammal,SA_WI,California Ground Squirrel,California ground squirrel,California Ground Squirrel,California Ground Squirrel,Otospermophilus beecheyi,2,0
2002875,SAHE3,77,SA,8/15/2023,6/13/2023,8/28/2023,2023,SA-SAHE3-2023,0,d01f67fd-836b-4b25-89fc-2239e59f56b0,Mammalia,Rodentia,Sciuridae,Otospermophilus,beecheyi,California Ground Squirrel,NA,2023-08-15T13:49:25Z,1,NA,NA,NA,NA,NA,NA,FALSE,NA,NA,CC-BY,NA,Mammal,SA_WI,California Ground Squirrel,California ground squirrel,California Ground Squirrel,California Ground Squirrel,Otospermophilus beecheyi,2,0
2002875,SAHE1,77,SA,8/15/2023,6/13/2023,8/28/2023,2023,SA-SAHE1-2023,0,d01f67fd-836b-4b25-89fc-2239e59f56b0,Mammalia,Rodentia,Sciuridae,Otospermophilus,beecheyi,California Ground Squirrel,NA,2023-08-15T13:52:37Z,1,NA,NA,NA,NA,NA,NA,FALSE,NA,NA,CC-BY,NA,Mammal,SA_WI,California Ground Squirrel,California ground squirrel,California Ground Squirrel,California Ground Squirrel,Otospermophilus beecheyi,2,0
2002875,SAHE2,77,SA,8/15/2023,6/13/2023,8/28/2023,2023,SA-SAHE2-2023,0,d01f67fd-836b-4b25-89fc-2239e59f56b0,Mammalia,Rodentia,Sciuridae,Otospermophilus,beecheyi,California Ground Squirrel,NA,2023-08-15T13:52:37Z,1,NA,NA,NA,NA,NA,NA,FALSE,NA,NA,CC-BY,NA,Mammal,SA_WI,California Ground Squirrel,California ground squirrel,California Ground Squirrel,California Ground Squirrel,Otospermophilus beecheyi,2,0
2002875,SAHE3,77,SA,8/15/2023,6/13/2023,8/28/2023,2023,SA-SAHE3-2023,0,d01f67fd-836b-4b25-89fc-2239e59f56b0,Mammalia,Rodentia,Sciuridae,Otospermophilus,beecheyi,California Ground Squirrel,NA,2023-08-15T13:52:38Z,1,NA,NA,NA,NA,NA,NA,FALSE,NA,NA,CC-BY,NA,Mammal,SA_WI,California Ground Squirrel,California ground squirrel,California Ground Squirrel,California Ground Squirrel,Otospermophilus beecheyi,2,0
